Review_8,Capacity,Noise_Level,Review_1,Review_3,Review_2,Review_5,Review_4,Review_7,Review_6,ASIN,Offer_Price,Brand,Item_name,No_of_Reviews,Energy_Efficiency,Part_No,MRP,Control_Console,Model,Best_Sellers_Rank_Category_AC,Best_Sellers_Rank_Category_home_kitchen,Color,Wattage,Installation_Type,Average_Rating,Voltage,Item_href
,1.5 tons,43 dB,Beware the price does not include installation charges. You would be required to pay an extra of Rs. 1500 to get the installation done.,,"Samsung AC purchased in Jan 2014, only used in summer, regularly serviced, still not working now and compressor and condensor both not working. Very bad products.",,,,,B01INIHUEO," 34,300.00",Samsung,"Samsung AR18JC3USUQ Split AC (1.5 Ton, 3 Star Rating, White): Amazon.in: Home & Kitchen",2 reviews,3 Star Rating,AR18JC3USUQ,,Remote Control,Brand Fulfilled,,,White,1580 Watts,Split,1.0 out of 5 stars,230 Volts,http://www.amazon.in/Samsung-AR18JC3USUQ-Split-Rating-White/dp/B01INIHUEO/ref=sr_1_339?ie=UTF8&qid=1485080079&s=kitchen&sr=1-339
,1.5 tons,43 dB,Beware the price does not include installation charges. You would be required to pay an extra of Rs. 1500 to get the installation done.,,"Samsung AC purchased in Jan 2014, only used in summer, regularly serviced, still not working now and compressor and condensor both not working. Very bad products.",,,,,B01INIHUEO," 34,300.00",Samsung,"Samsung AR18JC3USUQ Split AC (1.5 Ton, 3 Star Rating, White): Amazon.in: Home & Kitchen",2 reviews,3 Star Rating,AR18JC3USUQ,,Remote Control,Brand Fulfilled,,,White,1580 Watts,Split,1.0 out of 5 stars,230 Volts,http://www.amazon.in/Samsung-AR18JC3USUQ-Split-Rating-White/dp/B01INIHUEO/ref=sr_1_339_m?ie=UTF8&qid=1485080079&s=kitchen&sr=1-339
,1.5 tons,44 dB,,,,,,,,B01INIHUD0," 37,700.00",Samsung,"Samsung AR18JC3TFUR Split AC (1.5 Ton, 3 Star Rating, White): Amazon.in: Home & Kitchen",,3 Star Rating,AR18JC3TFUR,,Remote Control,Brand Fulfilled,,,White,1560 Watts,Split,,,http://www.amazon.in/Samsung-AR18JC3TFUR-Split-Rating-White/dp/B01INIHUD0/ref=sr_1_340_m?ie=UTF8&qid=1485080079&s=kitchen&sr=1-340
,2 tons,,,,,,,,,B01INHC64O," 59,150.00",Samsung,"Samsung AR24KV5NBWK Split AC (2 Ton, 5 Star Rating, Plain, Aluminium): Amazon.in: Home & Kitchen",,5 Star Rating,AR24KV5NBWK,"67,000.00",Remote Control,Brand Fulfilled,,,Plain,,Split,,,http://www.amazon.in/Samsung-AR24KV5NBWK-Split-Rating-Aluminium/dp/B01INHC64O/ref=sr_1_360?ie=UTF8&qid=1485080079&s=kitchen&sr=1-360
,1.5 tons,43 dB,,,,,,,,B01INIHUMG," 37,200.00",Samsung,"Samsung AR18JC3HBWK Split AC (1.5 Ton, 3 Star Rating, White): Amazon.in: Home & Kitchen",,3 Star Rating,AR18JC3HBWK,,Remote Control,Brand Fulfilled,,,White,1560 Watts,Split,,,http://www.amazon.in/Samsung-AR18JC3HBWK-Split-Rating-White/dp/B01INIHUMG/ref=sr_1_338_m?ie=UTF8&qid=1485080079&s=kitchen&sr=1-338
,1.5 tons,43 dB,,,,,,,,B01INIHUMG," 37,200.00",Samsung,"Samsung AR18JC3HBWK Split AC (1.5 Ton, 3 Star Rating, White): Amazon.in: Home & Kitchen",,3 Star Rating,AR18JC3HBWK,,Remote Control,Brand Fulfilled,,,White,1560 Watts,Split,,,http://www.amazon.in/Samsung-AR18JC3HBWK-Split-Rating-White/dp/B01INIHUMG/ref=sr_1_338?ie=UTF8&qid=1485080079&s=kitchen&sr=1-338
,1.5 tons,43 dB,i am using this product for one year. it's failure model. i am facing lot of issue with this ac.After six months.water leak in indoor unit.gas leakage problem.condenser failure in outdoor unit.coil failure in outdoor unit.all above are fixed in warranty period.Now problem continues.indoor coil failure.Very bad experience :(,,,,,,,B01INIHQCA," 32,900.00",Samsung,"Samsung AR18JC2JAMV Split AC (1.5 Ton, 2 Star Rating, White, Aluminium): Amazon.in: Home & Kitchen",1 review,2 Star Rating,AR18JC2JAMV,,Remote Control,Brand Fulfilled,,,White,1630 Watts,Split,1.0 out of 5 stars,,http://www.amazon.in/Samsung-AR18JC2JAMV-Split-Rating-Aluminium/dp/B01INIHQCA/ref=sr_1_342?ie=UTF8&qid=1485080079&s=kitchen&sr=1-342
,1.5 tons,44 dB,,,,,,,,B01INIHUD0," 37,700.00",Samsung,"Samsung AR18JC3TFUR Split AC (1.5 Ton, 3 Star Rating, White): Amazon.in: Home & Kitchen",,3 Star Rating,AR18JC3TFUR,,Remote Control,Brand Fulfilled,,,White,1560 Watts,Split,,,http://www.amazon.in/Samsung-AR18JC3TFUR-Split-Rating-White/dp/B01INIHUD0/ref=sr_1_340?ie=UTF8&qid=1485080079&s=kitchen&sr=1-340
,1 tons,37 dB,I bought this product from local market. Products perfomance is not good. More over the after sale service of Samsung is very bad in my area (Jalandhar). You need to call customer care repeatedly for routine service or repair.Service engineer will not appear till you feel harassed for 4-5 days. Customer care executive will never tell the visiting charges of service engineer. There is no option for zero star otherwise I would have been given zero star for after sale service by Samsung.,,,,,,,B01INIHG9S," 30,900.00",Samsung,"Samsung AR12HC3USNB Split AC (1 Ton, 3 Star Rating, White): Amazon.in: Home & Kitchen",1 review,3 Star Rating,AR12HC3USNB,,Remote Control,Brand Fulfilled,,,White,1065 Watts,Split,1.0 out of 5 stars,230 Volts,http://www.amazon.in/Samsung-AR12HC3USNB-Split-Rating-White/dp/B01INIHG9S/ref=sr_1_354_m?ie=UTF8&qid=1485080079&s=kitchen&sr=1-354
,1 tons,40 dB,,,,,,,,B01INIHK6M," 31,941.00",Samsung,"Samsung AR12KC5JAMC Split AC (1 Ton, 5 Star Rating, Blue Cosmo Strip): Amazon.in: Home & Kitchen",,5 Star Rating,AR12KC5JAMC,"36,900.00",Remote Control,Brand Fulfilled,,,Blue Cosmo Strip,,Split,,,http://www.amazon.in/Samsung-AR12KC5JAMC-Split-Rating-Cosmo/dp/B01INIHK6M/ref=sr_1_351?ie=UTF8&qid=1485080079&s=kitchen&sr=1-351
,1 tons,40 dB,,,,,,,,B01BNJB67M," 30,000.00",Blue Star,"Blue Star 3HW12JBG3 Split AC (1 Ton, 3 Star Rating, White): Amazon.in: Home & Kitchen",,3 Star Rating,,,Remote Control,3HW12JBG3,#472,"#4,48,689",White,1085 Watts,Split,,230 Volts,http://www.amazon.in/Blue-Star-3HW12JBG3-Split-Rating/dp/B01BNJB67M/ref=sr_1_483?ie=UTF8&qid=1485080079&s=kitchen&sr=1-483
,1 tons,39 dB,Never buy this product. I have had to service it 3 times in just 2 years and had to spend over 8000 rupees.,,,,,,,B01INIHGCU," 26,400.00",Samsung,"Samsung AR12JC2USUQ Split AC (1 Ton, 2 Star Rating, India Green): Amazon.in: Home & Kitchen",1 review,2 Star Rating,AR12JC2USUQ,,Remote Control,Brand Fulfilled,,,India Green,1100 Watts,Split,1.0 out of 5 stars,,http://www.amazon.in/Samsung-AR12JC2USUQ-Split-Rating-India/dp/B01INIHGCU/ref=sr_1_353?ie=UTF8&qid=1485080079&s=kitchen&sr=1-353
,1 tons,,,,,,,,,B01BDLCGR4," 29,700.00",LG,"LG LSA3AU4A Split AC (1 Ton, 4 Star Rating, White, Copper): Amazon.in: Home & Kitchen",,4 Star Rating,,,Remote Control,LSA3AU4A,,,White,990 Watts,Split,,230 Volts,http://www.amazon.in/LG-LSA3AU4A-Split-Rating-Copper/dp/B01BDLCGR4/ref=sr_1_486?ie=UTF8&qid=1485080079&s=kitchen&sr=1-486
,1 tons,39 dB,good ac ... lots of function on remote...,,,,,,,B01INIHG3E," 27,700.00",Samsung,"Samsung AR12JC2JAMV Split AC (1 Ton, 2 Star Rating, White): Amazon.in: Home & Kitchen",1 review,2 Star Rating,AR12JC2JAMV,,Remote Control,Brand Fulfilled,,,White,1090 Watts,Split,4.0 out of 5Review_8,Capacity,Noise_Level,Review_1,Review_3,Review_2,Review_5,Review_4,Review_7,Review_6,ASIN,Offer_Price,Brand,Item_name,No_of_Reviews,Energy_Efficiency,Part_No,MRP,Control_Console,Model,Best_Sellers_Rank_Category_AC,Best_Sellers_Rank_Category_home_kitchen,Color,Wattage,Installation_Type,Average_Rating,Voltage,Item_href
,2 tons,33 dB,"Very good in quality wise....,,prise thoda jayda ha ....i am satisfied.....and its a verygood product",Nice AC,It is excellent technology,,,,,B00PLQQDFY," 65,000.00",O General,"O General ASGA24JCC-2.0 Inverter Wall Mounted Split AC (2 Ton, White, Copper): Amazon.in: Home & Kitchen",3 reviews,Inverter,,,Remote Control,ASGA24JCC,#359,"#3,45,869",White,2450 Watts,Split,4.3 out of 5 stars,240 Volts,http://www.amazon.in/General-ASGA24JCC-2-0-Inverter-Mounted-Copper/dp/B00PLQQDFY/ref=sr_1_313/254-2636878-6305752?ie=UTF8&qid=1485082722&s=kitchen&sr=1-313
,1.5 tons,44 dB,,,,,,,,B01INII4GW," 42,400.00",Samsung,"Samsung AR18JC5TFUR Split AC (1.5 Ton, 5 Star Rating, White): Amazon.in: Home & Kitchen",,5 Star Rating,AR18JC5TFUR,,Remote Control,Brand Fulfilled,,,White,1495 Watts,Split,,,http://www.amazon.in/Samsung-AR18JC5TFUR-Split-Rating-White/dp/B01INII4GW/ref=sr_1_336/254-2636878-6305752?ie=UTF8&qid=1485082722&s=kitchen&sr=1-336
,2 tons,44 dB,,,,,,,,B01INII7DM," 44,300.00",Samsung,"Samsung AR24HC2USNB Split AC (2 Ton, 2 Star Rating, White): Amazon.in: Home & Kitchen",,2 Star Rating,AR24HC2USNB,,Remote Control,Brand Fulfilled,,,White,2030 Watts,Split,,230 Volts,http://www.amazon.in/Samsung-AR24HC2USNB-Split-Rating-White/dp/B01INII7DM/ref=sr_1_334_m/254-2636878-6305752?ie=UTF8&qid=1485082722&s=kitchen&sr=1-334
,1 tons,40 dB,,,,,,,,B01INH9FXY," 30,900.00",Samsung,"Samsung AR12HC5UCNB Split AC (1 Ton, 5 Star Rating, White, Aluminium): Amazon.in: Home & Kitchen",,5 Star Rating,AR12HC5UCNB,,Remote Control,Brand Fulfilled,,,White,,Split,,,http://www.amazon.in/Samsung-AR12HC5UCNB-Split-Rating-Aluminium/dp/B01INH9FXY/ref=sr_1_433/253-4723874-9064548?ie=UTF8&qid=1485082726&s=kitchen&sr=1-433
,2 tons,44 dB,"Very poor product and service quality. My AC had a circuit board issue in the out door unit and the reason cited is water leaked. in a matter of 14 months after purchase (just out of warranty) that too water leak in outdoor unit...for god's sake it is an outdoor unit that will be in the rain and you say water leaked...how is that not a manufacturing or installation defect...very pathetic...and now in another 6 months, stopped cooling...very pathetic product from samsung...strictly avoid...i purchased in Shahs Electronics store in Chennai and not via amazon...",Please Don't buy this A/C...Its very very bad,"This is a piece of junk . Bought it since the dealership talked about 20 feet air throw and looked good, but thats where it ends, worked beautifully for 6 months, after that its cooling is absolutely non existent. Called Samsung customer care several times, their AC technician doesnt even know how to open the damn thing, each visit they would open , clean the filter , close and say this is the max capacity cooling . Youre better off with a blue star or voltas . Samsung stop fleecing customers !!",,,,,B01INII76O," 60,100.00",Samsung,"Samsung AR24HV5NBWK Inverter AC (2 Ton, White, Aluminium): Amazon.in: Home & Kitchen",3 reviews,,AR24HV5NBWK,,Remote Control,Brand Fulfilled,,,White,1710 Watts,Split,1.0 out of 5 stars,230 Volts,http://www.amazon.in/Samsung-AR24HV5NBWK-Inverter-White-Aluminium/dp/B01INII76O/ref=sr_1_335/254-2636878-6305752?ie=UTF8&qid=1485082722&s=kitchen&sr=1-335
,1.5 tons,44 dB,,,,,,,,B01INII4GW," 42,400.00",Samsung,"Samsung AR18JC5TFUR Split AC (1.5 Ton, 5 Star Rating, White): Amazon.in: Home & Kitchen",,5 Star Rating,AR18JC5TFUR,,Remote Control,Brand Fulfilled,,,White,1495 Watts,Split,,,http://www.amazon.in/Samsung-AR18JC5TFUR-Split-Rating-White/dp/B01INII4GW/ref=sr_1_336_m/254-2636878-6305752?ie=UTF8&qid=1485082722&s=kitchen&sr=1-336
,1 tons,48 dB,,,,,,,,B01INH9IM2," 48,000.00",Samsung,"Samsung AR12HV5DAWK Split AC (1 Ton, 5 Star Rating, White): Amazon.in: Home & Kitchen",,5 Star Rating,AR12HV5DAWK,,Remote Control,Brand Fulfilled,,,White,,Split,,,http://www.amazon.in/Samsung-AR12HV5DAWK-Split-Rating-White/dp/B01INH9IM2/ref=sr_1_432_m/254-6373269-6131749?ie=UTF8&qid=1485082726&s=kitchen&sr=1-432
,1.5 tons,41 dB,,,,,,,,B01INHA9J8," 34,100.00",Samsung,"Samsung AR18FC3TAUR Split AC (1.5 Ton, 3 Star Rating, White): Amazon.in: Home & Kitchen",,3 Star Rating,AR18FC3TAUR,,Remote Control,Brand Fulfilled,,,White,,Split,,,http://www.amazon.in/Samsung-AR18FC3TAUR-Split-Rating-White/dp/B01INHA9J8/ref=sr_1_408_m/254-8499966-4893453?ie=UTF8&qid=1485082725&s=kitchen&sr=1-408
,1.5 tons,,,,,,,,,B01BSNSFVI," 43,645.00",Hitachi,"Hitachi RAU318KWEA Toushi Split AC (1.5 Ton, 3 Star Rating, White, Copper): Amazon.in: Home & Kitchen",,3 Star Rating,,"51,090.00",Remote Control,RAU318KWEA,,,White,,Split,,230 Volts,http://www.amazon.in/Hitachi-RAU318KWEA-Toushi-Rating-Copper/dp/B01BSNSFVI/ref=sr_1_480/253-8821984-9588916?ie=UTF8&qid=1485082727&s=kitchen&sr=1-480
,1 tons,47 dB,,,,,,,,B00PU1BSE6," 20,990.00",Lloyd,"Lloyd LW12A2N Window AC (1 Ton, 1 Star Rating, Cream): Amazon.in: Home & Kitchen",,1 Star Rating,,,Remote Control,LW12A2N,#352,"#3,39,769",Cream,,Window,,230 Volts,http://www.amazon.in/Lloyd-LW12A2N-Window-Rating-Cream/dp/B00PU1BSE6/ref=sr_1_312/253-5426461-9773724?ie=UTF8&qid=1485082721&s=kitchen&sr=1-312
,,,,,,,,,,B017AZNZRC," 50,000.00",Trane,"Trane Interactive Split Air Conditioner, 2.0 Ton, 2 Star , White, Copper): Amazon.in: Home & Kitchen",,2 Star Rating,TSR22DW2BSFC3,,,TSR22DW2BSFC3,,,Silver,2080.00,Split,,,http://www.amazon.in/Trane-Interactive-Split-Conditioner-White/dp/B017AZNZRC/ref=sr_1_505/254-3367447-3646326?ie=UTF8&qid=1485082728&s=kitchen&sr=1-505
,,,"Very Good Product. Renowned Brand from US. This company is now owned by Ignersoll Rand who are a big name in Industrial Compressor manufacturer. Best feature is the TRANE MODE. It has dual temp. sensors. One in indoor unit, other in outdoor unit. While using TRANE MODE, AC automatically adjusts inside room temp based upon the conditions outside.",,Excellent product with less power consumption,,,,,B017AZOQLG," 38,400.00",Trane,"Trane Interactive Split Air Conditioner, 1.5 Ton, 2 Star , White, Copper): Amazon.in: Home & Kitchen",2 reviews,2 Star Rating,TSR18DW2BSFC3,,,TSR18DW2BSFC3,,,White,1710.00,Split,5.0 out of 5 stars,,http://www.amazon.in/Trane-Interactive-Split-Conditioner-White/dp/B017AZOQLG/ref=sr_1_504/255-2839392-8818355?ie=UTF8&qid=1485082728&s=kitchen&sr=1-504
,2 tons,40 dB,,,,,,,,B00Y2U3PT2," 38,720.00",LG,"LG LSA6NP2A Split AC (2 Ton, 2 Star Rating, White, Aluminium): Amazon.in: Home & Kitchen",,2 Star Rating,LSA6NP2A,,Remote Control,LSA6NP2A,,,White,2100 Watts,Split,,230 Volts,http://www.amazon.in/LG-LSA6NP2A-Split-Rating-Aluminium/dp/B00Y2U3PT2/ref=sr_1_552/254-1149445-1496036?ie=UTF8&qid=1485082729&s=kitchen&sr=1-552
,1 tons,40 dB,,,,,,,,B00VUTWD5U," 30,744.00",Carrier,"Carrier 12K Octra Split AC (1 Ton, 3 Star Rating, White, Copper): Amazon.in: Home & Kitchen",,3 Star Rating,,,Remote Control,42KGE - 012Mm,,,White,983 Watts,Split,,230 Volts,http://www.amazon.in/Carrier-Octra-Split-Rating-Copper/dp/B00VUTWD5U/ref=sr_1_576/253-5712465-3882709?ie=UTF8&qid=1485082736&s=kitchen&sr=1-576
,2 tons,,,,,,,,,B01INHC64O," 59,150.00",Samsung,"Samsung AR24KV5NBWK Split AC (2 Ton, 5 Star Rating, Plain, Aluminium): Amazon.in: Home & Kitchen",,5 Star Rating,AR24KV5NBWK,"67,000.00",Remote Control,Brand Fulfilled,,,Plain,,Split,,,http://www.amazon.in/Samsung-AR24KV5NBWK-Split-Rating-Aluminium/dp/B01INHC64O/ref=sr_1_360_m/253-5162758-6574528?ie=UTF8&qid=1485082723&s=kitchen&sr=1-360
,2 tons,,,,,,,,,B01INHC64O," 59,150.00",Samsung,"Samsung AR24KV5NBWK Split AC (2 Ton, 5 Star Rating, Plain, Aluminium): Amazon.in: Home & Kitchen",,5 Star Rating,AR24KV5NBWK,"67,000.00",Remote Control,Brand Fulfilled,,,Plain,,Split,,,http://www.amazon.in/Samsung-AR24KV5NBWK-Split-Rating-Aluminium/dp/B01INHC64O/ref=sr_1_360/253-5162758-6574528?ie=UTF8&qid=1485082723&s=kitchen&sr=1-360
,2 tons,44 dB,"Using last 1.5 months , cooling is excellent, Our room is 240 sqft, air flow is very good, we are using at 27 degree temp in kolkata whether.",,,,,,,B01INHC6K8," 51,415.00",Samsung,"Samsung AR24KV5HBWK Split AC (2 Ton, 5 Star Rating, Plain, Aluminium): Amazon.in: Home & Kitchen",1 review,5 Star Rating,AR24KV5HBWK,"59,300.00",Remote Control,Brand Fulfilled,,,Plain,,Split,5.0 out of 5 stars,,http://www.amazon.in/Samsung-AR24KV5HBWK-Split-Rating-Aluminium/dp/B01INHC6K8/ref=sr_1_358_m/253-5162758-6574528?ie=UTF8&qid=1485082723&s=kitchen&sr=1-358
,2 tons,44 dB,"Using last 1.5 months , cooling is excellent, Our room is 240 sqft, air flow is very good, we are using at 27 degree temp in kolkata whether.",,,,,,,B01INHC6K8," 51,415.00",Samsung,"Samsung AR24KV5HBWK Split AC (2 Ton, 5 Star Rating, Plain, Aluminium): Amazon.in: Home & Kitchen",1 review,5 Star Rating,AR24KV5HBWK,"59,300.00",Remote Control,Brand Fulfilled,,,Plain,,Split,5.0 out of 5 stars,,http://www.amazon.in/Samsung-AR24KV5HBWK-Split-Rating-Aluminium/dp/B01INHC6K8/ref=sr_1_358/253-5162758-6574528?ie=UTF8&qid=1485082723&s=kitchen&sr=1-358
,2 tons,44 dB,,,,,,,,B01INHC6FI," 43,043.00",Samsung,"Samsung AR24KC3HATR Split AC (2 Ton, 3 Star Rating, Grey, Aluminium): Amazon.in: Home & Kitchen",,3 Star Rating,AR24KC3HATR,"49,700.00",Remote Control,Brand Fulfilled,,,Grey,,Split,,,http://www.amazon.in/Samsung-AR24KC3HATR-Split-Rating-Aluminium/dp/B01INHC6FI/ref=sr_1_359/253-5162758-6574528?ie=UTF8&qid=1485082723&s=kitchen&sr=1-359
,1 tons,39 dB,,,,,,,,B01INIHFYE," 31,800.00",Samsung,"Samsung AR12JC3HBWK Split AC (1 Ton, 3 Star Rating, White): Amazon.in: Home & Kitchen",,3 Star Rating,AR12JC3HBWK,,Remote Control,Brand Fulfilled,,,White,1090 Watts,Split,,,http://www.amazon.in/Samsung-AR12JC3HBWK-Split-Rating-White/dp/B01INIHFYE/ref=sr_1_357/253-5162758-6574528?ie=UTF8&qid=1485082723&s=kitchen&sr=1-357
,1 tons,39 dB,nice product,,,,,,,B01INIHG1G," 27,600.00",Samsung,"Samsung AR12HC2USNB Split AC (1 Ton, 2 Star Rating, White): Amazon.in: Home & Kitchen",1 review,2 Star Rating,AR12HC2USNB,,Remote Control,Brand Fulfilled,,,White,1100 Watts,Split,5.0 out of 5 stars,230 Volts,http://www.amazon.in/Samsung-AR12HC2USNB-Split-Rating-White/dp/B01INIHG1G/ref=sr_1_356_m/253-5162758-6574528?ie=UTF8&qid=1485082723&s=kitchen&sr=1-356
,1 tons,39 dB,nice product,,,,,,,B01INIHG1G," 27,600.00",Samsung,"Samsung AR12HC2USNB Split AC (1 Ton, 2 Star Rating, White): Amazon.in: Home & Kitchen",1 review,2 Star Rating,AR12HC2USNB,,Remote Control,Brand Fulfilled,,,White,1100 Watts,Split,5.0 out of 5 stars,230 Volts,http://www.amazon.in/Samsung-AR12HC2USNB-Split-Rating-White/dp/B01INIHG1G/ref=sr_1_356/253-5162758-6574528?ie=UTF8&qid=1485082723&s=kitchen&sr=1-356
,2 tons,44 dB,,,,,,,,B01INHC6FI," 43,043.00",Samsung,"Samsung AR24KC3HATR Split AC (2 Ton, 3 Star Rating, Grey, Aluminium): Amazon.in: Home & Kitchen",,3 Star Rating,AR24KC3HATR,"49,700.00",Remote Control,Brand Fulfilled,,,Grey,,Split,,,http://www.amazon.in/Samsung-AR24KC3HATR-Split-Rating-Aluminium/dp/B01INHC6FI/ref=sr_1_359_m/253-5162758-6574528?ie=UTF8&qid=1485082723&s=kitchen&sr=1-359
,1 tons,39 dB,good ac ... lots of function on remote...,,,,,,,B01INIHG3E," 27,700.00",Samsung,"Samsung AR12JC2JAMV Split AC (1 Ton, 2 Star Rating, White): Amazon.in: Home & Kitchen",1 review,2 Star Rating,AR12JC2JAMV,,Remote Control,Brand Fulfilled,,,White,1090 Watts,Split,4.0 out of 5 stars,,http://www.amazon.in/Samsung-AR12JC2JAMV-Split-Rating-White/dp/B01INIHG3E/ref=sr_1_355_m/253-5162758-6574528?ie=UTF8&qid=1485082723&s=kitchen&sr=1-355
,1 tons,39 dB,good ac ... lots of function on remote...,,,,,,,B01INIHG3E," 27,700.00",Samsung,"Samsung AR12JC2JAMV Split AC (1 Ton, 2 Star Rating, White): Amazon.in: Home & Kitchen",1 review,2 Star Rating,AR12JC2JAMV,,Remote Control,Brand Fulfilled,,,White,1090 Watts,Split,4.0 out of 5 stars,,http://www.amazon.in/Samsung-AR12JC2JAMV-Split-Rating-White/dp/B01INIHG3E/ref=sr_1_355/253-5162758-6574528?ie=UTF8&qid=1485082723&s=kitchen&sr=1-355
,1 tons,37 dB,I bought this product from local market. Products perfomance is not good. More over the after sale service of Samsung is very bad in my area (Jalandhar). You need to call customer care repeatedly for routine service or repair.Service engineer will not appear till you feel harassed for 4-5 days. Customer care executive will never tell the visiting charges of service engineer. There is no option for zero star otherwise I would have been given zero star for after sale service by Samsung.,,,,,,,B01INIHG9S," 30,900.00",Samsung,"Samsung AR12HC3USNB Split AC (1 Ton, 3 Star Rating, White): Amazon.in: Home & Kitchen",1 review,3 Star Rating,AR12HC3USNB,,Remote Control,Brand Fulfilled,,,White,1065 Watts,Split,1.0 out of 5 stars,230 Volts,http://www.amazon.in/Samsung-AR12HC3USNB-Split-Rating-White/dp/B01INIHG9S/ref=sr_1_354_m/253-5162758-6574528?ie=UTF8&qid=1485082723&s=kitchen&sr=1-354
,1 tons,37 dB,I bought this product from local market. Products perfomance is not good. More over the after sale service of Samsung is very bad in my area (Jalandhar). You need to call customer care repeatedly for routine service or repair.Service engineer will not appear till you feel harassed for 4-5 days. Customer care executive will never tell the visiting charges of service engineer. There is no option for zero star otherwise I would have been given zero star for after sale service by Samsung.,,,,,,,B01INIHG9S," 30,900.00",Samsung,"Samsung AR12HC3USNB Split AC (1 Ton, 3 Star Rating, White): Amazon.in: Home & Kitchen",1 review,3 Star Rating,AR12HC3USNB,,Remote Control,Brand Fulfilled,,,White,1065 Watts,Split,1.0 out of 5 stars,230 Volts,http://www.amazon.in/Samsung-AR12HC3USNB-Split-Rating-White/dp/B01INIHG9S/ref=sr_1_354/253-5162758-6574528?ie=UTF8&qid=1485082723&s=kitchen&sr=1-354
,1 tons,39 dB,Never buy this product. I have had to service it 3 times in just 2 years and had to spend over 8000 rupees.,,,,,,,B01INIHGCU," 26,400.00",Samsung,"Samsung AR12JC2USUQ Split AC (1 Ton, 2 Star Rating, India Green): Amazon.in: Home & Kitchen",1 review,2 Star Rating,AR12JC2USUQ,,Remote Control,Brand Fulfilled,,,India Green,1100 Watts,Split,1.0 out of 5 stars,,http://www.amazon.in/Samsung-AR12JC2USUQ-Split-Rating-India/dp/B01INIHGCU/ref=sr_1_353/253-5162758-6574528?ie=UTF8&qid=1485082723&s=kitchen&sr=1-353
,1 tons,48 dB,"Bought for Rs. 38500 from local dealer including installation cost in Nov 2014. No worries till now.Pros :1.Silent Performance(very low outdoor unit noise and indoor one almost silent)2. INVERTER AC - great savings on electricity bills. Difference of only Rs. 250 per month for shift from fan to moderate usage of AC.3. FAST COOLING4. Efficient Air Throw. Thanks to its Innovative TRIANGULAR DESIGN.5. 10 YEARS Warranty on Compressor.6. SAMSUNG Product.Cons :1. No LED 88 Display for Temperature indication on AC. But it's present on remote. It's present on higher model in similar Samsung AC series (known to me before purchase, no regrets minor issue:))2. No backlit keys and backlit display on the provided remote control unit. Difficult at night.3. No automatic horizontal control on air throw. Manually adjustable though.All the cons are very minor issues. Can be overlooked.Biggest thing matters to me is fast, efficient cooling; savings and no problems in functioning of AC.Go for it. Value for money. Thumbs up from my side.",Good design and good performance,I bought this product from Croma in March 2014 and last month it went repair and they claim Condenser gone and they want me to spend 9000/- in 2 years I bought 1 Ton for 35000/- thinking that I will save in my electricity bill which made me fool to buy Samsung who are not good in AC inventions.While purchase the salesman said 5 years warranty on all and 10 years warranty on Compressor and now they say no sir.Only first year is full warranty.I hate Samsung and Croma Mount Road Chennai Sales and Service People.Call me before you think of buying this product.,It's the second time my 1. Year old AC as stopped cooling...... Totally dissatisfied....,very worst product. no proper service from samsung.. i bought this on april 2014. no proper spares.. please dont buy this.,,,B01INIHGR0," 41,600.00",Samsung,"Samsung AR12HV5NBWK Split AC (1 Ton, 5 Star Rating, White): Amazon.in: Home & Kitchen",5 reviews,5 Star Rating,AR12HV5NBWK,,Remote Control,Brand Fulfilled,,,White,910 Watts,Split,2.8 out of 5 stars,230 Volts,http://www.amazon.in/Samsung-AR12HV5NBWK-Split-Rating-White/dp/B01INIHGR0/ref=sr_1_352_m/253-5162758-6574528?ie=UTF8&qid=1485082723&s=kitchen&sr=1-352
,1 tons,48 dB,"Bought for Rs. 38500 from local dealer including installation cost in Nov 2014. No worries till now.Pros :1.Silent Performance(very low outdoor unit noise and indoor one almost silent)2. INVERTER AC - great savings on electricity bills. Difference of only Rs. 250 per month for shift from fan to moderate usage of AC.3. FAST COOLING4. Efficient Air Throw. Thanks to its Innovative TRIANGULAR DESIGN.5. 10 YEARS Warranty on Compressor.6. SAMSUNG Product.Cons :1. No LED 88 Display for Temperature indication on AC. But it's present on remote. It's present on higher model in similar Samsung AC series (known to me before purchase, no regrets minor issue:))2. No backlit keys and backlit display on the provided remote control unit. Difficult at night.3. No automatic horizontal control on air throw. Manually adjustable though.All the cons are very minor issues. Can be overlooked.Biggest thing matters to me is fast, efficient cooling; savings and no problems in functioning of AC.Go for it. Value for money. Thumbs up from my side.",Good design and good performance,I bought this product from Croma in March 2014 and last month it went repair and they claim Condenser gone and they want me to spend 9000/- in 2 years I bought 1 Ton for 35000/- thinking that I will save in my electricity bill which made me fool to buy Samsung who are not good in AC inventions.While purchase the salesman said 5 years warranty on all and 10 years warranty on Compressor and now they say no sir.Only first year is full warranty.I hate Samsung and Croma Mount Road Chennai Sales and Service People.Call me before you think of buying this product.,It's the second time my 1. Year old AC as stopped cooling...... Totally dissatisfied....,very worst product. no proper service from samsung.. i bought this on april 2014. no proper spares.. please dont buy this.,,,B01INIHGR0," 41,600.00",Samsung,"Samsung AR12HV5NBWK Split AC (1 Ton, 5 Star Rating, White): Amazon.in: Home & Kitchen",5 reviews,5 Star Rating,AR12HV5NBWK,,Remote Control,Brand Fulfilled,,,White,910 Watts,Split,2.8 out of 5 stars,230 Volts,http://www.amazon.in/Samsung-AR12HV5NBWK-Split-Rating-White/dp/B01INIHGR0/ref=sr_1_352/253-5162758-6574528?ie=UTF8&qid=1485082723&s=kitchen&sr=1-352
