Review_8,Capacity,Noise_Level,Review_1,Review_3,Review_2,Review_5,Review_4,Review_7,Review_6,ASIN,Offer_Price,Brand,Item_name,No_of_Reviews,Energy_Efficiency,Part_No,MRP,Control_Console,Model,Best_Sellers_Rank_Category_AC,Best_Sellers_Rank_Category_home_kitchen,Color,Wattage,Installation_Type,Average_Rating,Voltage,Item_href
,1 tons,39 dB,,,,,,,,B00VUTY6O6," 38,052.00",Carrier,"Carrier 12K Octra Inverter Split AC (1 Ton, White, Copper): Amazon.in: Home & Kitchen",,Inverter,,,Remote Control,MS11D12-12CRDN3-QC2,,,White,1048 Watts,Split,,230 Volts,http://www.amazon.in/Carrier-Octra-Inverter-Split-Copper/dp/B00VUTY6O6/ref=sr_1_570/255-6401717-3654001?ie=UTF8&qid=1485080007&s=kitchen&sr=1-570
,1 tons,38 dB,,,,,,,,B00WQZWA00," 36,500.00",IFB,"IFB IACS12JCCTC Inverter Split AC (1 Ton, White, Copper): Amazon.in: Home & Kitchen",,Inverter,,"42,990.00",Remote Control,IACS12JCCTC,,,White,1080 Watts,Split,,240 Volts,http://www.amazon.in/IFB-IACS12JCCTC-Inverter-Split-Copper/dp/B00WQZWA00/ref=sr_1_564/255-6401717-3654001?ie=UTF8&qid=1485080007&s=kitchen&sr=1-564
,1.5 tons,42 dB,,,,,,,,B00WU347WM," 36,600.00",Blue Star,"Blue Star 3HW18FB1 Split AC (1.5 Ton, 3 Star Rating, White, Copper): Amazon.in: Home & Kitchen",,3 Star Rating,,"38,800.00",Remote Control,3HW18FB1,,,White,1550 Watts,Split,,230 Volts,http://www.amazon.in/Blue-Star-3HW18FB1-Rating-Copper/dp/B00WU347WM/ref=sr_1_561/255-6401717-3654001?ie=UTF8&qid=1485080007&s=kitchen&sr=1-561
,2 tons,37 dB,,,,,,,,B00WR3WQ5A," 49,399.00",Hitachi,"Hitachi RAU324AVD Split AC (2 Ton, 3 Star Rating, White, Copper): Amazon.in: Home & Kitchen",,3 Star Rating,,,,RAU324AVD,#458,"#4,33,602",White,2134 Watts,Split,,230 Volts,http://www.amazon.in/Hitachi-RAU324AVD-Split-Rating-Copper/dp/B00WR3WQ5A/ref=sr_1_563/255-6401717-3654001?ie=UTF8&qid=1485080007&s=kitchen&sr=1-563
,1 tons,39 dB,,,,,,,,B00VUTXA2A," 33,768.00",Carrier,"Carrier 12K Octra Split AC (1 Ton, 5 Star Rating, White, Copper): Amazon.in: Home & Kitchen",,5 Star Rating,,,Remote Control,42KGN - 012Sm,,,White,940 Watts,Split,,230 Volts,http://www.amazon.in/Carrier-Octra-Split-Rating-Copper/dp/B00VUTXA2A/ref=sr_1_573/255-6401717-3654001?ie=UTF8&qid=1485080007&s=kitchen&sr=1-573
,2 tons,47 dB,,,,,,,,B00VUTX09I," 42,840.00",Carrier,"Carrier 24K Octra Split AC (2 Ton, 3 Star Rating, White, Copper): Amazon.in: Home & Kitchen",,3 Star Rating,,,Remote Control,42KGE - 024Mm,,,White,1910 Watts,Split,,230 Volts,http://www.amazon.in/Carrier-Octra-Split-Rating-Copper/dp/B00VUTX09I/ref=sr_1_574/255-6401717-3654001?ie=UTF8&qid=1485080007&s=kitchen&sr=1-574
,2 tons,48 dB,,,,,,,,B00WU34E20," 44,900.00",Blue Star,"Blue Star 3HW24FB1 Split AC (2 Ton, 3 Star Rating, White, Copper): Amazon.in: Home & Kitchen",,3 Star Rating,,"47,600.00",Remote Control,3HW24FB1,,,White,1960 Watts,Split,,230 Volts,http://www.amazon.in/Blue-Star-3HW24FB1-Rating-Copper/dp/B00WU34E20/ref=sr_1_560/255-6401717-3654001?ie=UTF8&qid=1485080007&s=kitchen&sr=1-560
,2 tons,50 dB,the AC works very well. I ordered it to get cooling in three rooms together so that i could avoid purchasing two diff ac for three rooms. And this ac serves the purpose absolutely fine. The assembling cost a little high but that is applicable with any other AC. Its just the first year and I am hopeful it works fine for the coming years also. The only problem comes that LLOYD doesn't accept the sale made by Amazon since it is not its authorized dealer. So after purchase you have to tell lloyd customer care the name of the dealer not the amazon then they install it. so far so good.,,,,,,,B00U2DWZ08," 35,885.00",Lloyd,"Lloyd LS24A2P Split AC (2 Ton, 2 Star Rating, White): Amazon.in: Home & Kitchen",1 review,3 Star Rating,,,,LS24A2P,#314,"#3,08,096",White,2005 Watts,Split,4.0 out of 5 stars,230 Volts,http://www.amazon.in/Lloyd-LS24A2P-Split-Rating-White/dp/B00U2DWZ08/ref=sr_1_289/255-2574919-0037163?ie=UTF8&qid=1485080008&s=kitchen&sr=1-289
,1 tons,35 dB,,,,,,,,B00W7BRUE4," 27,450.00",Whirlpool,"Whirlpool 3D Cool Xtreme PLT V Split AC (1 Ton, 5 Star Rating, Silver): Amazon.in: Home & Kitchen",,5 Star Rating,,,Remote Control,WHIRBQ113,,,Silver,950 Watts,Split,,230 Volts,http://www.amazon.in/Whirlpool-Xtreme-Split-Rating-Silver/dp/B00W7BRUE4/ref=sr_1_566/255-6401717-3654001?ie=UTF8&qid=1485080007&s=kitchen&sr=1-566
,2 tons,40 dB,,,,,,,,B00WU33SNQ,,LG,"LG LSA6AU2A Split AC (2 Ton, 2 Star Rating, White, Copper): Amazon.in: Home & Kitchen",,2 Star Rating,,"43,490.00",Remote Control,LSA6AU2A,,,White,2040 Watts,Split,,230 Volts,http://www.amazon.in/LG-LSA6AU2A-Split-Rating-Copper/dp/B00WU33SNQ/ref=sr_1_562/255-6401717-3654001?ie=UTF8&qid=1485080007&s=kitchen&sr=1-562
,1 tons,48 dB,,,,,,,,B01INH9IM2," 48,000.00",Samsung,"Samsung AR12HV5DAWK Split AC (1 Ton, 5 Star Rating, White): Amazon.in: Home & Kitchen",,5 Star Rating,AR12HV5DAWK,,Remote Control,Brand Fulfilled,,,White,,Split,,,http://www.amazon.in/Samsung-AR12HV5DAWK-Split-Rating-White/dp/B01INH9IM2/ref=sr_1_432_m/254-8295230-0627740?ie=UTF8&qid=1485080007&s=kitchen&sr=1-432
,,,,,,,,,,B017AZNZRC," 50,000.00",Trane,"Trane Interactive Split Air Conditioner, 2.0 Ton, 2 Star , White, Copper): Amazon.in: Home & Kitchen",,2 Star Rating,TSR22DW2BSFC3,,,TSR22DW2BSFC3,,,Silver,2080.00,Split,,,http://www.amazon.in/Trane-Interactive-Split-Conditioner-White/dp/B017AZNZRC/ref=sr_1_505/255-6091695-9565635?ie=UTF8&qid=1485080007&s=kitchen&sr=1-505
,1 tons,33 dB,,,,,,,,B00WUF8Y6U," 28,000.00",Videocon,"Videocon VSD33 GV1 Split AC (1 Ton, 3 Star Rating, Graphic): Amazon.in: Home & Kitchen",,3 Star Rating,,,Remote Control,VSD33 GV1,#710,"#6,49,107",Graphic,1070 Watts,Split,,230 Volts,http://www.amazon.in/Videocon-VSD33-GV1-Rating-Graphic/dp/B00WUF8Y6U/ref=sr_1_558/255-6401717-3654001?ie=UTF8&qid=1485080007&s=kitchen&sr=1-558
,1.5 tons,44 dB,,,,,,,,B00VUTWM1K," 33,990.00",Carrier,"Carrier 18K Octra Split AC (1.5 Ton, 3 Star Rating, White, Copper): Amazon.in: Home & Kitchen",,3 Star Rating,1.5 Ton 3S Octra,"40,900.00",Remote Control,42KGE - 018Mm,#716,"#6,50,455",White,1530 Watts,Split,,230 Volts,http://www.amazon.in/Carrier-Octra-Split-Rating-Copper/dp/B00VUTWM1K/ref=sr_1_575/255-6401717-3654001?ie=UTF8&qid=1485080007&s=kitchen&sr=1-575
,1.5 tons,38 dB,,,,,,,,B00W7BSXAY," 34,000.00",Whirlpool,"Whirlpool 3D Cool PLT V Split AC (1.5 Ton, 5 Star Rating, Silver): Amazon.in: Home & Kitchen",,5 Star Rating,,,Remote Control,WHIEUY129,,,Silver,1451 Watts,Split,,230 Volts,http://www.amazon.in/Whirlpool-Cool-Split-Rating-Silver/dp/B00W7BSXAY/ref=sr_1_565/255-6401717-3654001?ie=UTF8&qid=1485080007&s=kitchen&sr=1-565
,1 tons,,,,,,,,,B00Y05ZVV4," 30,055.00",Blue Star,"Blue Star 3HW12FC1 Split AC (1 Ton, 3 Star Rating, White, Copper): Amazon.in: Home & Kitchen",,3 Star Rating,3HW12FC1,"32,300.00",,3HW12FC1,,,White,1055 Watts,Split,,,http://www.amazon.in/Blue-Star-3HW12FC1-Rating-Copper/dp/B00Y05ZVV4/ref=sr_1_553/255-6401717-3654001?ie=UTF8&qid=1485080007&s=kitchen&sr=1-553
,2 tons,47 dB,,,,,,,,B00VUTYRYU," 54,180.00",Carrier,"Carrier 24K Octra Inverter Split AC (2 Ton, White, Copper): Amazon.in: Home & Kitchen",,Inverter,,,Remote Control,MS11D12-21CRDN3-QC2W,,,White,1947 Watts,Split,,230 Volts,http://www.amazon.in/Carrier-Octra-Inverter-Split-Copper/dp/B00VUTYRYU/ref=sr_1_568/255-6401717-3654001?ie=UTF8&qid=1485080007&s=kitchen&sr=1-568
,1 tons,35 dB,This is working well so far and is apt for my mums flat in india which is two bedrooms. It's working well and Keeps the home cool. Easy to use so far.,,,,,,,B00W7BQZZO," 32,000.00",Whirlpool,"Whirlpool 3D Cool DLX Plus III Split AC (1 Ton, 3 Star Rating, White): Amazon.in: Home & Kitchen",1 review,3 Star Rating,,,Remote Control,WHIANC109,#507,"#5,04,831",White,1053 Watts,Split,5.0 out of 5 stars,230 Volts,http://www.amazon.in/Whirlpool-Cool-Split-Rating-White/dp/B00W7BQZZO/ref=sr_1_567/255-6401717-3654001?ie=UTF8&qid=1485080007&s=kitchen&sr=1-567
,1.5 tons,48 dB,"I bought this AC recently. It cools my 12x12 room pretty quickly with in 5 to 6 minutes.Installation:Installation from Carrier folks is OK if not good/excellent. But in this HOT demanding Summer probably I would not expect much more from these AC companies. Be sure to purchase a Stabilizer as well if you are purchasing the AC online. Because, carrier folks when they come for installation, they do not bring or sell any additional stuff (like stand for ODU, power chord, copper wire or stabilizer) And they charged 1500 for installation.Product:Almost all the sites, this particular product is shown with a flower design on the Indoor Unit. However, the one I got did not have. Checked on carrier website, it appears that ACs made this year this flower design is not there for OCTRA model. Cooling wise it is very good so far. Cools my 12 by 12 root pretty quickly in 6 to 7 minutes.Overall I am happy with the unit. Probably after using it for a while I can post another update.",,,,,,,B00VUTXJJ4," 40,236.00",Carrier,"Carrier 18K Octra Split AC (1.5 Ton, 5 Star Rating, White, Copper): Amazon.in: Home & Kitchen",1 review,5 Star Rating,,,Remote Control,42KGN - 018Nm,#666,"#6,35,013",White,1471 Watts,Split,4.0 out of 5 stars,230 Volts,http://www.amazon.in/Carrier-Octra-Split-Rating-Copper/dp/B00VUTXJJ4/ref=sr_1_572/255-6401717-3654001?ie=UTF8&qid=1485080007&s=kitchen&sr=1-572
,1.5 tons,48 dB,,,,,,,,B010DLWT3G," 31,000.00",Voltas,"Voltas 1.5T183LYI Split AC (1.5 Ton, 3 Star Rating, White, Copper): Amazon.in: Home & Kitchen",,3 Star Rating,1.5 T 183 LYi,,Remote Control,1.5 T 183 LYi,#469,"#4,43,907",White,1539 Watts,Split,,230 Volts,http://www.amazon.in/Voltas-1-5T183LYI-1-5-Rating-Copper/dp/B010DLWT3G/ref=sr_1_529/253-2784943-2189700?ie=UTF8&qid=1485080007&s=kitchen&sr=1-529
,2 tons,51 dB,,,,,,,,B010DLYTF2,,Voltas,"Voltas 2.0T24VEYW Split AC (2 Ton, White, Aluminium): Amazon.in: Home & Kitchen",,,2.0 T 24V EY-W,"73,480.00",Remote Control,2.0 T 24V EY-W,#402,"#3,90,285",White,1985 Watts,Split,,230 Volts,http://www.amazon.in/Voltas-2-0T24VEYW-Split-White-Aluminium/dp/B010DLYTF2/ref=sr_1_526/255-6091695-9565635?ie=UTF8&qid=1485080007&s=kitchen&sr=1-526
,1 tons,42 dB,,,,,,,,B010DLYK9M,,Voltas,"Voltas 1.0T12VEYW Split AC (1 Ton, White, Copper): Amazon.in: Home & Kitchen",,,1.0 T 12V EY-W,,Remote Control,1.0 T 12V EY-W,,,White,1080 Watts,Split,,230 Volts,http://www.amazon.in/Voltas-1-0T12VEYW-Split-White-Copper/dp/B010DLYK9M/ref=sr_1_527/255-6091695-9565635?ie=UTF8&qid=1485080007&s=kitchen&sr=1-527
,1 tons,33 dB,"Never buy Videocon products!!!!, their after sell service s***ks...they have appointed some third class companies for electronic product after sell service....I have just wasted my hard earned 27k by buying Videocon AC....11 months 3 repairs and still giving problems...I wanted register 4th complaint before 1 year warranty period but these people made me wait and called me back after warranty period got over...and now asking money for repair..worst electronic product company in India...",,,,,,,B012AMMBIY," 25,890.00",Videocon,"Videocon VSD35.WV1-MDA Split AC (1 Ton, 5 Star Rating, White) with Free VC060P 47-Litre Refrigerator: Amazon.in: Home & Kitchen",1 review,5 Star Rating,,"32,990.00",Remote Control,VSD35.WV1-MDA + VC060P,,,White,995 Watts,Split,1.0 out of 5 stars,230 Volts,http://www.amazon.in/Videocon-VSD35-WV1-MDA-VC060P-47-Litre-Refrigerator/dp/B012AMMBIY/ref=sr_1_525/255-6091695-9565635?ie=UTF8&qid=1485080007&s=kitchen&sr=1-525
,1.5 tons,,,,,,,,,B013I8NQG0," 36,000.00",Voltas,"Voltas 183 Sprint Y Series Split AC (1.5 Ton, 3 Star Rating, White, Copper): Amazon.in: Home & Kitchen",,3 Star Rating,,,Remote Control,1.5 TON 183 SY,,,White,,Split,,230 Volts,http://www.amazon.in/Voltas-183-Sprint-1-5-Rating/dp/B013I8NQG0/ref=sr_1_523/255-6091695-9565635?ie=UTF8&qid=1485080007&s=kitchen&sr=1-523
,2 tons,,,,,,,,,B01BSNSK9U," 59,200.00",Hitachi,"Hitachi RAU324AWEA Kashikoi Split AC (2 Ton, 3 Star Rating, White, Copper): Amazon.in: Home & Kitchen",,3 Star Rating,,,Remote Control,RAU324AWEA,,,White,,Split,,230 Volts,http://www.amazon.in/Hitachi-RAU324AWEA-Kashikoi-Rating-Copper/dp/B01BSNSK9U/ref=sr_1_473/253-6029875-4538509?ie=UTF8&qid=1485080008&s=kitchen&sr=1-473
,1 tons,,,,,,,,,B01BSNSHRA," 50,899.00",Hitachi,"Hitachi RAU512IWEA Kashikoi Split AC (1 Ton, 5 Star Rating, White, Copper): Amazon.in: Home & Kitchen",,5 Star Rating,,"56,690.00",Remote Control,RAU512IWEA,#502,"#5,00,033",White,,Split,,,http://www.amazon.in/Hitachi-RAU512IWEA-Kashikoi-Rating-Copper/dp/B01BSNSHRA/ref=sr_1_479/253-6029875-4538509?ie=UTF8&qid=1485080008&s=kitchen&sr=1-479
,1.5 tons,,,,,,,,,B01BSNSHS4," 51,000.00",Hitachi,"Hitachi RAU518AWEA Kashikoi Split AC (1.5 Ton, 5 Star Rating, White, Copper): Amazon.in: Home & Kitchen",,5 Star Rating,,"59,090.00",Remote Control,RAU518AWEA,#516,"#5,09,726",White,,Split,,230 Volts,http://www.amazon.in/Hitachi-RAU518AWEA-Kashikoi-Rating-Copper/dp/B01BSNSHS4/ref=sr_1_477/253-6029875-4538509?ie=UTF8&qid=1485080008&s=kitchen&sr=1-477
,1.7 tons,44 dB,,,,,,,,B01INHC1BC," 66,800.00",Samsung,"Samsung AR24JV5NBWK Split AC (1.7 Ton, 5 Star Rating, White): Amazon.in: Home & Kitchen",,5 Star Rating,AR24JV5NBWK,,Remote Control,Brand Fulfilled,,,White,1710 Watts,Split,,230 Volts,http://www.amazon.in/Samsung-AR24JV5NBWK-Split-Rating-White/dp/B01INHC1BC/ref=sr_1_361/255-1453627-1374867?ie=UTF8&qid=1485080008&s=kitchen&sr=1-361
,0.75 tons,,,,,,,,,B01CFY8RBM," 18,500.00",Blue Star,"Blue Star 3WAE081YDF Window AC (0.75 Ton, 3 Star Rating, White): Amazon.in: Home & Kitchen",,3 Star Rating,,,Remote Control,3WAE081YDF,#665,"#6,34,465",White,,Window,,,http://www.amazon.in/Blue-Star-3WAE081YDF-Window-Rating/dp/B01CFY8RBM/ref=sr_1_471/253-6029875-4538509?ie=UTF8&qid=1485080008&s=kitchen&sr=1-471
,2 tons,50 dB,,,,,,,,B00WW5T2UK," 40,000.00",Panasonic,"Panasonic UC24RKY2 Split AC (2 Ton, 2 Star Rating, White, Copper): Amazon.in: Home & Kitchen",,2 Star Rating,UC24RKY2,,Remote Control,UC24RKY2,#543,"#5,20,955",White,2100 Watts,Split,,230 Volts,http://www.amazon.in/Panasonic-UC24RKY2-Split-Rating-Copper/dp/B00WW5T2UK/ref=sr_1_557/255-6401717-3654001?ie=UTF8&qid=1485080007&s=kitchen&sr=1-557
,1.5 tons,48 dB,,,,,,,,B010DLYA56," 39,800.00",Voltas,"Voltas 1.5T18VEYW Split AC (1.5 Ton, White, Aluminium): Amazon.in: Home & Kitchen",,,,"59,990.00",Remote Control,,#514,"#5,09,401",White,1600 Watts,Split,,230 Volts,http://www.amazon.in/Voltas-1-5T18VEYW-Split-1-5-Aluminium/dp/B010DLYA56/ref=sr_1_528/255-6091695-9565635?ie=UTF8&qid=1485080007&s=kitchen&sr=1-528
,1.8 tons,47 dB,,,,,,,,B013UCHZ6G," 44,000.00",Daikin,"Daikin R-32 DTC Series Split AC (1.8 Ton, 3 Star Rating, White): Amazon.in: Home & Kitchen",,3 Star Rating,,"50,100.00",Remote Control,DTC60QRV16,#524,"#5,12,785",White,1970 Watts,Split,,230 Volts,http://www.amazon.in/Daikin-R-32-Split-Rating-White/dp/B013UCHZ6G/ref=sr_1_522/255-6091695-9565635?ie=UTF8&qid=1485080007&s=kitchen&sr=1-522
,2 tons,,never buy this AC..its useless..service is very poor.my ac broke down within 5 days. no response from customer care also.I never expected the quality of product and service is so poor for a brand like HITACHI.,,,,,,,B01BSNSIEW," 59,090.00",Hitachi,"Hitachi RAU524AVD Zunoh Split AC (2 Ton, 5 Star Rating, White, Copper): Amazon.in: Home & Kitchen",1 review,5 Star Rating,,,Remote Control,RAU524AVD,,,White,,Split,1.0 out of 5 stars,230 Volts,http://www.amazon.in/Hitachi-RAU524AVD-Zunoh-Rating-Copper/dp/B01BSNSIEW/ref=sr_1_475/253-6029875-4538509?ie=UTF8&qid=1485080008&s=kitchen&sr=1-475
,1.5 tons,,,,,,,,,B01BSNSFVI," 43,645.00",Hitachi,"Hitachi RAU318KWEA Toushi Split AC (1.5 Ton, 3 Star Rating, White, Copper): Amazon.in: Home & Kitchen",,3 Star Rating,,"51,090.00",Remote Control,RAU318KWEA,,,White,,Split,,230 Volts,http://www.amazon.in/Hitachi-RAU318KWEA-Toushi-Rating-Copper/dp/B01BSNSFVI/ref=sr_1_480/253-6029875-4538509?ie=UTF8&qid=1485080008&s=kitchen&sr=1-480
,1.5 tons,,,,,,,,,B01BSNSHRK," 61,000.00",Hitachi,"Hitachi RAU518IWEA Kashikoi Split AC (1.5 Ton, 5 Star Rating, White, Copper): Amazon.in: Home & Kitchen",,5 Star Rating,,,Remote Control,RAU518IWEA,#515,"#5,09,540",White,,Split,,230 Volts,http://www.amazon.in/Hitachi-RAU518IWEA-Kashikoi-Rating-Copper/dp/B01BSNSHRK/ref=sr_1_478/253-6029875-4538509?ie=UTF8&qid=1485080008&s=kitchen&sr=1-478
,2 tons,45 dB,,,,,,,,B01C6WI6TQ,,Electrolux,"Electrolux ES24L3C Remote Control Split AC (2 Ton, 3 Star Rating, White): Amazon.in: Home & Kitchen",,3 Star Rating,,,Remote Control,ES24L3C,,,White,6650 Watts,Split,,230 Volts,http://www.amazon.in/Electrolux-ES24L3C-Remote-Control-Rating/dp/B01C6WI6TQ/ref=sr_1_472/253-6029875-4538509?ie=UTF8&qid=1485080008&s=kitchen&sr=1-472
,1.5 tons,,,,,,,,,B01INHB9RE," 30,940.00",Samsung,"Samsung AR18KC2JAMC Split AC (1.5 Ton, 2 Star Rating, Blue Cosmo Strip): Amazon.in: Home & Kitchen",,2 Star Rating,AR18KC2JAMC,"47,100.00",Remote Control,Brand Fulfilled,,,Blue Cosmo Strip,,Split,,,http://www.amazon.in/Samsung-AR18KC2JAMC-Split-Rating-Cosmo/dp/B01INHB9RE/ref=sr_1_384_m/255-1453627-1374867?ie=UTF8&qid=1485080008&s=kitchen&sr=1-384
,2 tons,42 dB,,,,,,,,B01INHBPYQ," 40,900.00",Samsung,"Samsung AR24FC2TAUR Split AC (2 Ton, 2 Star Rating, White): Amazon.in: Home & Kitchen",,2 Star Rating,AR24FC2TAUR,,Remote Control,Brand Fulfilled,,,White,,Split,,,http://www.amazon.in/Samsung-AR24FC2TAUR-Split-Rating-White/dp/B01INHBPYQ/ref=sr_1_367/255-1453627-1374867?ie=UTF8&qid=1485080008&s=kitchen&sr=1-367
,1.5 tons,,,,,,,,,B01INHB9RE," 30,940.00",Samsung,"Samsung AR18KC2JAMC Split AC (1.5 Ton, 2 Star Rating, Blue Cosmo Strip): Amazon.in: Home & Kitchen",,2 Star Rating,AR18KC2JAMC,"47,100.00",Remote Control,Brand Fulfilled,,,Blue Cosmo Strip,,Split,,,http://www.amazon.in/Samsung-AR18KC2JAMC-Split-Rating-Cosmo/dp/B01INHB9RE/ref=sr_1_384/255-1453627-1374867?ie=UTF8&qid=1485080008&s=kitchen&sr=1-384
,1.5 tons,43 dB,,,,,,,,B01INHBFLO," 33,215.00",Samsung,"Samsung AR18KC3JEMC Split AC (1.5 Ton, 3 Star Rating, Blue Cosmo Strip, Aluminium): Amazon.in: Home & Kitchen",,3 Star Rating,AR18KC3JEMC,"38,300.00",Remote Control,Brand Fulfilled,,,Blue Cosmo Strip,,Split,,,http://www.amazon.in/Samsung-AR18KC3JEMC-Split-Rating-Aluminium/dp/B01INHBFLO/ref=sr_1_380/255-1453627-1374867?ie=UTF8&qid=1485080008&s=kitchen&sr=1-380
,1.5 tons,43 dB,,,,,,,,B01INHBFPK," 34,580.00",Samsung,"Samsung AR18KC3HDTR Split AC (1.5 Ton, 3 Star Rating, Grey, Aluminium): Amazon.in: Home & Kitchen",,3 Star Rating,AR18KC3HDTR,"49,700.00",Remote Control,Brand Fulfilled,#652,"#6,23,761",Grey,,Split,,,http://www.amazon.in/Samsung-AR18KC3HDTR-Split-Rating-Aluminium/dp/B01INHBFPK/ref=sr_1_378/255-1453627-1374867?ie=UTF8&qid=1485080008&s=kitchen&sr=1-378
,1.5 tons,43 dB,,,,,,,,B01INHBFLO," 33,215.00",Samsung,"Samsung AR18KC3JEMC Split AC (1.5 Ton, 3 Star Rating, Blue Cosmo Strip, Aluminium): Amazon.in: Home & Kitchen",,3 Star Rating,AR18KC3JEMC,"38,300.00",Remote Control,Brand Fulfilled,,,Blue Cosmo Strip,,Split,,,http://www.amazon.in/Samsung-AR18KC3JEMC-Split-Rating-Aluminium/dp/B01INHBFLO/ref=sr_1_380_m/255-1453627-1374867?ie=UTF8&qid=1485080008&s=kitchen&sr=1-380
,1.5 tons,,nice,,,,,,,B01INHBKBY," 44,499.00",Samsung,"Samsung AR18KV5HBTQ Split AC (1.5 Ton, 5 Star Rating, Lily Blue): Amazon.in: Home & Kitchen",1 review,5 Star Rating,AR18KV5HBTQ,"51,400.00",Remote Control,Brand Fulfilled,,,Lily Blue,,Split,5.0 out of 5 stars,,http://www.amazon.in/Samsung-AR18KV5HBTQ-Split-Star-Rating/dp/B01INHBKBY/ref=sr_1_373/255-1453627-1374867?ie=UTF8&qid=1485080008&s=kitchen&sr=1-373
,1.5 tons,43 dB,,,,,,,,B01INHBFTG," 34,580.00",Samsung,"Samsung AR18KC3HDTP Split AC (1.5 Ton, 3 Star Rating, Lily Grey, Aluminium): Amazon.in: Home & Kitchen",,3 Star Rating,AR18KC3HDTP,"39,900.00",Remote Control,Brand Fulfilled,,,Lily Grey,,Split,,,http://www.amazon.in/Samsung-AR18KC3HDTP-Split-Rating-Aluminium/dp/B01INHBFTG/ref=sr_1_375/255-1453627-1374867?ie=UTF8&qid=1485080008&s=kitchen&sr=1-375
,1.5 tons,,,,,,,,,B01CFY9AUY," 43,500.00",Blue Star,"Blue Star BI-5HW18ZARTX Split AC (1.5 Ton, 3 Star Rating, Wine Red): Amazon.in: Home & Kitchen",,5 Star Rating,,,Remote Control,BI-5HW18ZARTX,,,Wine Red,,Split,,230 Volts,http://www.amazon.in/Blue-Star-BI-5HW18ZARTX-Split-Rating/dp/B01CFY9AUY/ref=sr_1_457/253-6029875-4538509?ie=UTF8&qid=1485080008&s=kitchen&sr=1-457
,2 tons,33 dB,"Very good in quality wise....,,prise thoda jayda ha ....i am satisfied.....and its a verygood product",Nice AC,It is excellent technology,,,,,B00PLQQDFY," 65,000.00",O General,"O General ASGA24JCC-2.0 Inverter Wall Mounted Split AC (2 Ton, White, Copper): Amazon.in: Home & Kitchen",3 reviews,Inverter,,,Remote Control,ASGA24JCC,#359,"#3,45,869",White,2450 Watts,Split,4.3 out of 5 stars,240 Volts,http://www.amazon.in/General-ASGA24JCC-2-0-Inverter-Mounted-Copper/dp/B00PLQQDFY/ref=sr_1_313/255-4260654-1007340?ie=UTF8&qid=1485080007&s=kitchen&sr=1-313
,1.5 tons,43 dB,,,,,,,,B01INHBFUA," 36,036.00",Samsung,"Samsung AR18KC3EDLW Split AC (1.5 Ton, 3 Star Rating, Refined Wine, Aluminium): Amazon.in: Home & Kitchen",,3 Star Rating,AR18KC3EDLW,"41,600.00",Remote Control,Brand Fulfilled,,,Refined Wine,,Split,,,http://www.amazon.in/Samsung-AR18KC3EDLW-Rating-Refined-Aluminium/dp/B01INHBFUA/ref=sr_1_374_m/255-1453627-1374867?ie=UTF8&qid=1485080008&s=kitchen&sr=1-374
,1.5 tons,43 dB,,,,,,,,B01INHBFUA," 36,036.00",Samsung,"Samsung AR18KC3EDLW Split AC (1.5 Ton, 3 Star Rating, Refined Wine, Aluminium): Amazon.in: Home & Kitchen",,3 Star Rating,AR18KC3EDLW,"41,600.00",Remote Control,Brand Fulfilled,,,Refined Wine,,Split,,,http://www.amazon.in/Samsung-AR18KC3EDLW-Rating-Refined-Aluminium/dp/B01INHBFUA/ref=sr_1_374/255-1453627-1374867?ie=UTF8&qid=1485080008&s=kitchen&sr=1-374
,1.5 tons,43 dB,,,,,,,,B01INHB9W4," 31,941.00",Samsung,"Samsung AR18KC2HATR Split AC (1.5 Ton, 2 Star Rating, Grey, Aluminium): Amazon.in: Home & Kitchen",,2 Star Rating,AR18KC2HATR,"36,900.00",Remote Control,Brand Fulfilled,,,Grey,,Split,,,http://www.amazon.in/Samsung-AR18KC2HATR-Split-Rating-Aluminium/dp/B01INHB9W4/ref=sr_1_383/255-1453627-1374867?ie=UTF8&qid=1485080008&s=kitchen&sr=1-383
,1.5 tons,43 dB,,,,,,,,B01INHBFTG," 34,580.00",Samsung,"Samsung AR18KC3HDTP Split AC (1.5 Ton, 3 Star Rating, Lily Grey, Aluminium): Amazon.in: Home & Kitchen",,3 Star Rating,AR18KC3HDTP,"39,900.00",Remote Control,Brand Fulfilled,,,Lily Grey,,Split,,,http://www.amazon.in/Samsung-AR18KC3HDTP-Split-Rating-Aluminium/dp/B01INHBFTG/ref=sr_1_375_m/255-1453627-1374867?ie=UTF8&qid=1485080008&s=kitchen&sr=1-375
,1.5 tons,44 dB,,,,,,,,B01INII4GW," 42,400.00",Samsung,"Samsung AR18JC5TFUR Split AC (1.5 Ton, 5 Star Rating, White): Amazon.in: Home & Kitchen",,5 Star Rating,AR18JC5TFUR,,Remote Control,Brand Fulfilled,,,White,1495 Watts,Split,,,http://www.amazon.in/Samsung-AR18JC5TFUR-Split-Rating-White/dp/B01INII4GW/ref=sr_1_336/255-4260654-1007340?ie=UTF8&qid=1485080007&s=kitchen&sr=1-336
,1.5 tons,44 dB,,,,,,,,B01INII4GW," 42,400.00",Samsung,"Samsung AR18JC5TFUR Split AC (1.5 Ton, 5 Star Rating, White): Amazon.in: Home & Kitchen",,5 Star Rating,AR18JC5TFUR,,Remote Control,Brand Fulfilled,,,White,1495 Watts,Split,,,http://www.amazon.in/Samsung-AR18JC5TFUR-Split-Rating-White/dp/B01INII4GW/ref=sr_1_336_m/255-4260654-1007340?ie=UTF8&qid=1485080007&s=kitchen&sr=1-336
,1.5 tons,43 dB,"Samsung AC purchased in Jan 2014, only used in summer, regularly serviced, still not working now and compressor and condensor both not working. Very bad products.",,,,,,,B01INHBFRS," 34,216.00",Samsung,"Samsung AR18KC3HDWK Split AC (1.5 Ton, 3 Star Rating, Plain, Aluminium): Amazon.in: Home & Kitchen",1 review,3 Star Rating,AR18KC3HDWK,"39,500.00",Remote Control,Brand Fulfilled,,,Plain,,Split,1.0 out of 5 stars,,http://www.amazon.in/Samsung-AR18KC3HDWK-Split-Rating-Aluminium/dp/B01INHBFRS/ref=sr_1_376_m/255-1453627-1374867?ie=UTF8&qid=1485080008&s=kitchen&sr=1-376
,1.5 tons,,nice,,,,,,,B01INHBKBY," 44,499.00",Samsung,"Samsung AR18KV5HBTQ Split AC (1.5 Ton, 5 Star Rating, Lily Blue): Amazon.in: Home & Kitchen",1 review,5 Star Rating,AR18KV5HBTQ,"51,400.00",Remote Control,Brand Fulfilled,,,Lily Blue,,Split,5.0 out of 5 stars,,http://www.amazon.in/Samsung-AR18KV5HBTQ-Split-Star-Rating/dp/B01INHBKBY/ref=sr_1_373_m/255-1453627-1374867?ie=UTF8&qid=1485080008&s=kitchen&sr=1-373
,1.5 tons,43 dB,,,,,,,,B01INHB9W4," 31,941.00",Samsung,"Samsung AR18KC2HATR Split AC (1.5 Ton, 2 Star Rating, Grey, Aluminium): Amazon.in: Home & Kitchen",,2 Star Rating,AR18KC2HATR,"36,900.00",Remote Control,Brand Fulfilled,,,Grey,,Split,,,http://www.amazon.in/Samsung-AR18KC2HATR-Split-Rating-Aluminium/dp/B01INHB9W4/ref=sr_1_383_m/255-1453627-1374867?ie=UTF8&qid=1485080008&s=kitchen&sr=1-383
,1.5 tons,45 dB,,,,,,,,B01INHBAMS," 51,000.00",Samsung,"Samsung AR18JV5HBTQ Split AC (1.5 Ton, 5 Star Rating, White): Amazon.in: Home & Kitchen",,5 Star Rating,AR18JV5HBTQ,,Remote Control,Brand Fulfilled,,,White,1520 Watts,Split,,230 Volts,http://www.amazon.in/Samsung-AR18JV5HBTQ-Split-Rating-White/dp/B01INHBAMS/ref=sr_1_381/255-1453627-1374867?ie=UTF8&qid=1485080008&s=kitchen&sr=1-381
,1.5 tons,43 dB,"Excellent product ever seen .No noise pollution ,power saving ,immediate cooling ,appears as a prestigious item in the room ,various options in AC are very very useful .",Best AC in Range ...-VERY FAST COOLING-NO NOISE-EASY OPERATING,"Samsung AC purchased in Jan 2014, only used in summer, regularly serviced, still not working now and compressor and condensor both not working. Very bad products.",,,,,B01INHBFR8," 33,215.00",Samsung,"Samsung AR18KC3JDMC Split AC (1.5 Ton, 3 Star Rating, Blue Cosmo Strip, Aluminium): Amazon.in: Home & Kitchen",3 reviews,3 Star Rating,AR18KC3JDMC,"38,300.00",Remote Control,Brand Fulfilled,,,Blue Cosmo Strip,,Split,3.7 out of 5 stars,,http://www.amazon.in/Samsung-AR18KC3JDMC-Split-Rating-Aluminium/dp/B01INHBFR8/ref=sr_1_377/255-1453627-1374867?ie=UTF8&qid=1485080008&s=kitchen&sr=1-377
