Review_8,Capacity,Noise_Level,Review_1,Review_3,Review_2,Review_5,Review_4,Review_7,Review_6,ASIN,Offer_Price,Brand,Item_name,No_of_Reviews,Energy_Efficiency,Part_No,MRP,Control_Console,Model,Best_Sellers_Rank_Category_AC,Best_Sellers_Rank_Category_home_kitchen,Color,Wattage,Installation_Type,Average_Rating,Voltage,Item_href
,1 tons,,,,,,,,,B01CFY9AK4," 36,400.00",Blue Star,"Blue Star BI-5HW12ZAWTX Split AC (1 Ton, 5 Star Rating, White, Aluminium): Amazon.in: Home & Kitchen",,5 Star Rating,,,Remote Control,BI-5HW12ZAWTX,,,White,,Split,,230 Volts,http://www.amazon.in/Blue-Star-BI-5HW12ZAWTX-Rating-Aluminium/dp/B01CFY9AK4/ref=sr_1_461/253-8821984-9588916?ie=UTF8&qid=1485082727&s=kitchen&sr=1-461
,1.5 tons,,Running good so far. Cooling is great. It's been about 2 weeks sixne I've been using it. Looks pretty nice and has a great LED display. Running at 24 in Mumbai heat and does great. I'm hoping to see it last long.,Noise. Free and very stable cooling,Efficient in both cooling and energy consumption,,,,,B01CFY94HI," 35,498.00",Blue Star,"Blue Star BI-3HW18VCU Split AC (1.5 Ton, 3 Star Rating, White, Copper): Amazon.in: Home & Kitchen",6 reviews,3 Star Rating,,,Remote Control,BI-3HW18VCU,#523,"#5,12,467",White,,Split,4.3 out of 5 stars,230 Volts,http://www.amazon.in/Blue-Star-BI-3HW18VCU-Rating-Copper/dp/B01CFY94HI/ref=sr_1_463/253-8821984-9588916?ie=UTF8&qid=1485082727&s=kitchen&sr=1-463
,1.5 tons,,,,,,,,,B01CFY9AMW," 39,920.00",Blue Star,"Blue Star BI-5HW18ZAWTX Split AC (1.5 Ton, 5 Star Rating, White): Amazon.in: Home & Kitchen",,5 Star Rating,,,Remote Control,BI-5HW18ZAWTX,,,White,,Split,,,http://www.amazon.in/Blue-Star-BI-5HW18ZAWTX-Split-Rating/dp/B01CFY9AMW/ref=sr_1_460/253-8821984-9588916?ie=UTF8&qid=1485082727&s=kitchen&sr=1-460
,1 tons,,,,,,,,,B01CFY9AQS," 37,100.00",Blue Star,"Blue Star BI-5HW12ZAGTX Split AC (1 Ton, 5 Star Rating, Champagne Gold): Amazon.in: Home & Kitchen",,5 Star Rating,,,Remote Control,BI-5HW12ZAGTX,,,Champagne Gold,,Split,,,http://www.amazon.in/Blue-Star-BI-5HW12ZAGTX-Rating-Champagne/dp/B01CFY9AQS/ref=sr_1_458/253-8821984-9588916?ie=UTF8&qid=1485082727&s=kitchen&sr=1-458
,1 tons,,,,,,,,,B01CFY9AP4," 37,100.00",Blue Star,"Blue Star BI-5HW12ZARTX Split AC (1 Ton, 3 Star Rating, Wine Red): Amazon.in: Home & Kitchen",,5 Star Rating,,,Remote Control,BI-5HW12ZARTX,,,Wine Red,,Split,,,http://www.amazon.in/Blue-Star-BI-5HW12ZARTX-Split-Rating/dp/B01CFY9AP4/ref=sr_1_459/253-8821984-9588916?ie=UTF8&qid=1485082727&s=kitchen&sr=1-459
,1.5 tons,,,,,,,,,B01CFY9AUY," 43,500.00",Blue Star,"Blue Star BI-5HW18ZARTX Split AC (1.5 Ton, 3 Star Rating, Wine Red): Amazon.in: Home & Kitchen",,5 Star Rating,,,Remote Control,BI-5HW18ZARTX,,,Wine Red,,Split,,230 Volts,http://www.amazon.in/Blue-Star-BI-5HW18ZARTX-Split-Rating/dp/B01CFY9AUY/ref=sr_1_457/253-8821984-9588916?ie=UTF8&qid=1485082727&s=kitchen&sr=1-457
,1 tons,,"The worst AC ever. Purchased 2 Lloyd ACs from Amazon.in, within 8 days of installation Lloyd ACs stopped working. There was no cooling by ACs. I approached Lloyd Customer Care No. and they told that Lloyd does not provide any warranty on the products purchased from Amazon.inI approached Amazon.in, they said we are just a platform you please contact Lloyd for the warranty. When I approached Lloyd they refused to provide warranty for their own product saying that Amazon is not our authorized dealer so we will not provide warranty.Amazon.in and Lloyd both are playing game. Now we are going to Consumer Court against Lloyd and Amazon both.Amazon is misleading customers and Lloyd is cheated customers.","The design is not as attractive as it looks in image, the name Curvella is just okay to fit. Also 1 ton AC air blowing capacity is not so good and is on little lower side. Now just need to observe power usage for a 3 star AC.","It has one of the WORST after sales SUPPORT. I have purchased a Lloyd AC but after 1 year some issue came and it stopped working because of which when i called customer Care AND I was unable to reach them for first few days because of Line Busy.2. When I was able to register my complain, there is no action taken from Lloyd side. I contacted Area Manager also but his number was also not reachable.3. It is not khusiyon kee guarantee rather it is tension kee guarantee.Customers, after sales support is very important so buy accordingly.People buying the LLOYD products, be careful.I REQUEST AMAZON FOR NOT TO SPOIL THEIR BRAND VALUE BECAUSE OF LLOYDS.My complaint number- 050515215784",Amazing product and amazing experience with AMAZON !,The product just looks good. Not even once did it cool down the 10*10 room even after using it for hours. Complete waste of money. Get the other brands which are durable. R-22 Gas has been filled couple of times but the Ac won't work. Compressor works but its weak. No wonder they are not even in the top 10 ac brands.,,,B00PU1DWI6," 23,500.00",Lloyd,"Lloyd Curvella LS13A3P Split AC (1 Ton, 3 Star Rating, White): Amazon.in: Home & Kitchen",5 reviews,3 Star Rating,,"25,990.00",Remote Control,LS13A3P,#301,"#2,95,511",White,1162 Watts,Split,2.2 out of 5 stars,230 Volts,http://www.amazon.in/Lloyd-Curvella-LS13A3P-Split-Rating/dp/B00PU1DWI6/ref=sr_1_311/253-5426461-9773724?ie=UTF8&qid=1485082721&s=kitchen&sr=1-311
,1.5 tons,,,,,,,,,B01CFY94JG," 43,600.00",Blue Star,"Blue Star BI-5HW18SAFX Split AC (1.5 Ton, 3 Star Rating, White, Aluminium): Amazon.in: Home & Kitchen",,3 Star Rating,,,Remote Control,BI-5HW18SAFX,,,White,,Split,,,http://www.amazon.in/Blue-Star-BI-5HW18SAFX-Rating-Aluminium/dp/B01CFY94JG/ref=sr_1_462/253-8821984-9588916?ie=UTF8&qid=1485082727&s=kitchen&sr=1-462
,1.5 tons,,Using it almost 1 year .....it is an amazing ac...with copper pipe. Did a lot of research for buying ac atlast ...opted for this...trust u will really love it for the price tag,Good,Excellent performer at this budget!!!!,,,,,B00PU1E3U2," 31,990.00",Lloyd,"Lloyd Curvella LS19A3PN Split AC (1.5 Ton, 3 Star Rating, White): Amazon.in: Home & Kitchen",3 reviews,3 Star Rating,,,Remote Control,LS19A3PN,#380,"#3,65,592",White,1560 Watts,Split,4.3 out of 5 stars,230 Volts,http://www.amazon.in/Lloyd-Curvella-LS19A3PN-Split-Rating/dp/B00PU1E3U2/ref=sr_1_310/253-5426461-9773724?ie=UTF8&qid=1485082721&s=kitchen&sr=1-310
,1.5 tons,,Average,,,,,,,B00PU1ELL8," 28,200.00",Lloyd,"Lloyd Pure Sure LS19A3LN Split AC (1.5 Ton, 3 Star Rating, White): Amazon.in: Home & Kitchen",1 review,3 Star Rating,,"32,900.00",Remote Control,LS19A3LN,#311,"#3,07,528",White,1605 Watts,Split,1.0 out of 5 stars,230 Volts,http://www.amazon.in/Lloyd-LS19A3LN-Split-Rating-White/dp/B00PU1ELL8/ref=sr_1_309/253-5426461-9773724?ie=UTF8&qid=1485082721&s=kitchen&sr=1-309
,1.5 tons,49 dB,very good cooling,,Good,,,,,B00PUAIAI4," 55,400.00",Mitsubishi,"Mitsubishi MSY-GE18VA Inverter Cooling Split AC (1.5 Ton, White): Amazon.in: Home & Kitchen",2 reviews,Inverter,,"65,920.00",Remote Control,MSY-GE18VA,#386,"#3,69,709",White,1430 Watts,Split,5.0 out of 5 stars,230 Volts,http://www.amazon.in/Mitsubishi-MSY-GE18VA-Inverter-Cooling-Split/dp/B00PUAIAI4/ref=sr_1_308/253-5426461-9773724?ie=UTF8&qid=1485082721&s=kitchen&sr=1-308
,2 tons,53 dB,,,,,,,,B00PVM5O0I," 54,599.00",Mitsubishi,"Mitsubishi MS-GK24VA Cooling Split AC (2 Ton, 5 Star Rating, White): Amazon.in: Home & Kitchen",,5 Star Rating,,"64,830.00",Remote Control,MS-GK24VA,#330,"#3,26,362",White,1850 Watts,Split,,230 Volts,http://www.amazon.in/Mitsubishi-MS-GK24VA-Cooling-Split-Rating/dp/B00PVM5O0I/ref=sr_1_307/253-5426461-9773724?ie=UTF8&qid=1485082721&s=kitchen&sr=1-307
,1 tons,,,,,,,,,B00REFXAM4," 31,000.00",Blue Star,"Blue Star 3HW12HAF1 Split AC (1 Ton, 3 Star Rating, White, Aluminium): Amazon.in: Home & Kitchen",,3 Star Rating,,"32,800.00",,3HW12HAF1,#323,"#3,18,991",White,1115 Watts,Split,,230 Volts,http://www.amazon.in/Blue-Star-3HW12HAF1-Rating-Aluminium/dp/B00REFXAM4/ref=sr_1_305/253-5426461-9773724?ie=UTF8&qid=1485082721&s=kitchen&sr=1-305
,1.5 tons,38 dB,"Excellent cooling, gives in just 10 minutes of time , look and design of ac was good ,go for it without any hesitation",,Poor service from ONIDA.  They do not replace defective products.Go to Youtube and search for SAY NO TO ONIDA.,,,,,B00RZCPMEK," 32,500.00",Onida,"Onida S183SMH Split AC (1.5 Ton, 3 Star Rating, White, Copper): Amazon.in: Home & Kitchen",2 reviews,3 Star Rating,,"36,790.00",,S183SMH,#372,"#3,60,953",White,1580 Watts,Split,3.0 out of 5 stars,230 Volts,http://www.amazon.in/Onida-S183SMH-Split-Rating-Copper/dp/B00RZCPMEK/ref=sr_1_303/253-5426461-9773724?ie=UTF8&qid=1485082721&s=kitchen&sr=1-303
,1 tons,35 dB,i want this ac dilvered to pin number 517325 but not availabull show,,,,,,,B00TZMV0J4," 37,990.00",LG,"LG LSA3WT5D L-Energia Split AC (1 Ton, 5 Star Rating, Wine Red, Copper): Amazon.in: Home & Kitchen",1 review,5 Star Rating,,,,LSA3WT5D,#329,"#3,25,299",Wine Red,980 Watts,Split,5.0 out of 5 stars,230 Volts,http://www.amazon.in/LG-LSA3WT5D-L-Energia-Rating-Copper/dp/B00TZMV0J4/ref=sr_1_298/253-5426461-9773724?ie=UTF8&qid=1485082721&s=kitchen&sr=1-298
,1.5 tons,36 dB,Cooolll,,,,,,,B00TZMWA66," 42,990.00",LG,"LG LSA5SP5D L-Stella Plus Split AC (1.5 Ton, 5 Star Rating, White, Aluminium): Amazon.in: Home & Kitchen",1 review,5 Star Rating,,,,LSA5SP5D,#306,"#2,99,843",White,1465 Watts,Split,5.0 out of 5 stars,230 Volts,http://www.amazon.in/LG-LSA5SP5D-L-Stella-Rating-Aluminium/dp/B00TZMWA66/ref=sr_1_297/253-5426461-9773724?ie=UTF8&qid=1485082721&s=kitchen&sr=1-297
,1 tons,40 dB,,,,,,,,B00RZCRG0S," 29,250.00",Blue Star,"Blue Star 3HW12JB1 Split AC (1 Ton, 3 Star Rating, Golden, Aluminium): Amazon.in: Home & Kitchen",,3 Star Rating,,"31,700.00",,3HW12JB1,#326,"#3,22,950",Golden,1085 Watts,Split,,230 Volts,http://www.amazon.in/Blue-Star-3HW12JB1-Rating-Aluminium/dp/B00RZCRG0S/ref=sr_1_300/253-5426461-9773724?ie=UTF8&qid=1485082721&s=kitchen&sr=1-300
,1.5 tons,36 dB,,,,,,,,B00TZMWLE2," 44,990.00",LG,"LG LSA5ST5D L-Energia Silver Split AC (1.5 Ton, 5 Star Rating, White, Aluminium): Amazon.in: Home & Kitchen",,5 Star Rating,,,,LSA5ST5D,#373,"#3,62,179",White,1465 Watts,Split,,230 Volts,http://www.amazon.in/LG-LSA5ST5D-L-Energia-Silver-Aluminium/dp/B00TZMWLE2/ref=sr_1_296/253-5426461-9773724?ie=UTF8&qid=1485082721&s=kitchen&sr=1-296
,2 tons,57 dB,,,,,,,,B00RZCQWXK," 29,000.00",Blue Star,"Blue Star 2W24LA Window AC (2 Ton, 2 Star Rating, White, Copper): Amazon.in: Home & Kitchen",,2 Star Rating,,"34,000.00",,2W24LA,#318,"#3,12,352",White,2080 Watts,Window,,230 Volts,http://www.amazon.in/Blue-Star-2W24LA-Window-Rating/dp/B00RZCQWXK/ref=sr_1_301/253-5426461-9773724?ie=UTF8&qid=1485082721&s=kitchen&sr=1-301
,1 tons,48 dB,,,,,,,,B00TZN0K58," 24,790.00",LG,"LG LWA3GP3A L-Gratis Plus Window AC (1 Ton, 3 Star Rating, White, Copper): Amazon.in: Home & Kitchen",,3 Star Rating,,,,LWA3GP3A,#375,"#3,64,112",White,1055 Watts,Window,,230 Volts,http://www.amazon.in/LG-LWA3GP3A-L-Gratis-Window-Rating/dp/B00TZN0K58/ref=sr_1_294/253-5426461-9773724?ie=UTF8&qid=1485082721&s=kitchen&sr=1-294
,1 tons,50 dB,,,,,,,,B00TZN0PFI," 29,290.00",LG,"LG LWA3GT5A L-Gratis Terminator Window AC (1 Ton, 5 Star Rating, White, Copper): Amazon.in: Home & Kitchen",,5 Star Rating,,,,LWA3GT5A,#355,"#3,40,402",White,1125 Watts,Window,,230 Volts,http://www.amazon.in/LG-LWA3GT5A-L-Gratis-Terminator-Window/dp/B00TZN0PFI/ref=sr_1_293/253-5426461-9773724?ie=UTF8&qid=1485082721&s=kitchen&sr=1-293
,1.5 tons,52 dB,"I choose this because t was a 5 star energy compliant. I was worried about the power bills so this was was as per my expectations. The remote control was also sleek and well built. The ac cooled my 1500 cubit feet room is 10 minutes, it was relay cool. I always set the ambient temperature to 25 degrees for best efficiency. The grill quality is also good. The fine inner mesh was stopping all dirt good and I just had to clean it once a  week. The power cord is sturdy and supplied plug is also ISI compliant. The noise was also not more that 40dB.",,"Worst ever ac don't buy it,  if u set it @ 24 degrees and ur room temparature is 30, the compressor will automatically shut down when ur room temperature decreases by JUST 1 DEGREES, i.e ur room temperature would be 29, and ur ac would shut down,THINK TWICE BEFORE BUYING IT, DON'T WANT ANYBODY TO FACE THE PROBLEM THAT I AM FACING, FORGET CHILLING THE ROOM WITH THIS AC.",,,,,B00TZN16EW," 29,990.00",LG,"LG LWA5CP5A L-Crescent Plus Window AC (1.5 Ton, 5 Star Rating, White, Copper): Amazon.in: Home & Kitchen",2 reviews,5 Star Rating,,"34,490.00",,LWA5CP5A,#378,"#3,65,429",White,1415 Watts,Window,2.5 out of 5 stars,230 Volts,http://www.amazon.in/LG-LWA5CP5A-L-Crescent-Window-Rating/dp/B00TZN16EW/ref=sr_1_292/253-5426461-9773724?ie=UTF8&qid=1485082721&s=kitchen&sr=1-292
,1 tons,34 dB,,,,,,,,B00U2DWL34," 24,990.00",Lloyd,"Lloyd LS13A2N Split AC (1 Ton, 2 Star Rating, White): Amazon.in: Home & Kitchen",,2 Star Rating,,,,LS13A2N,#368,"#3,57,805",White,1230 Watts,Split,,230 Volts,http://www.amazon.in/Lloyd-LS13A2N-Split-Rating-White/dp/B00U2DWL34/ref=sr_1_290/253-5426461-9773724?ie=UTF8&qid=1485082721&s=kitchen&sr=1-290
,2 tons,50 dB,the AC works very well. I ordered it to get cooling in three rooms together so that i could avoid purchasing two diff ac for three rooms. And this ac serves the purpose absolutely fine. The assembling cost a little high but that is applicable with any other AC. Its just the first year and I am hopeful it works fine for the coming years also. The only problem comes that LLOYD doesn't accept the sale made by Amazon since it is not its authorized dealer. So after purchase you have to tell lloyd customer care the name of the dealer not the amazon then they install it. so far so good.,,,,,,,B00U2DWZ08," 35,885.00",Lloyd,"Lloyd LS24A2P Split AC (2 Ton, 2 Star Rating, White): Amazon.in: Home & Kitchen",1 review,3 Star Rating,,,,LS24A2P,#314,"#3,08,096",White,2005 Watts,Split,4.0 out of 5 stars,230 Volts,http://www.amazon.in/Lloyd-LS24A2P-Split-Rating-White/dp/B00U2DWZ08/ref=sr_1_289/253-5426461-9773724?ie=UTF8&qid=1485082721&s=kitchen&sr=1-289
,1.5 tons,41 dB,,,,,,,,B01INHA9J8," 34,100.00",Samsung,"Samsung AR18FC3TAUR Split AC (1.5 Ton, 3 Star Rating, White): Amazon.in: Home & Kitchen",,3 Star Rating,AR18FC3TAUR,,Remote Control,Brand Fulfilled,,,White,,Split,,,http://www.amazon.in/Samsung-AR18FC3TAUR-Split-Rating-White/dp/B01INHA9J8/ref=sr_1_408/254-8499966-4893453?ie=UTF8&qid=1485082725&s=kitchen&sr=1-408
,1.5 tons,43 dB,,,,,,,,B01INHADD0," 38,400.00",Samsung,"Samsung AR18HC3EXLW Split AC (1.5 Ton, 3 Star Rating, Maroon and Wine, Aluminium): Amazon.in: Home & Kitchen",,3 Star Rating,AR18HC3EXLW,,Remote Control,Brand Fulfilled,,,Maroon and Wine,,Split,,,http://www.amazon.in/Samsung-AR18HC3EXLW-Rating-Maroon-Aluminium/dp/B01INHADD0/ref=sr_1_406_m/254-8499966-4893453?ie=UTF8&qid=1485082725&s=kitchen&sr=1-406
,1.5 tons,43 dB,,,,,,,,B01INHADD0," 38,400.00",Samsung,"Samsung AR18HC3EXLW Split AC (1.5 Ton, 3 Star Rating, Maroon and Wine, Aluminium): Amazon.in: Home & Kitchen",,3 Star Rating,AR18HC3EXLW,,Remote Control,Brand Fulfilled,,,Maroon and Wine,,Split,,,http://www.amazon.in/Samsung-AR18HC3EXLW-Rating-Maroon-Aluminium/dp/B01INHADD0/ref=sr_1_406/254-8499966-4893453?ie=UTF8&qid=1485082725&s=kitchen&sr=1-406
,1.5 tons,43 dB,,,,,,,,B01INHADAI," 37,100.00",Samsung,"Samsung AR18HC3TXNC Split AC (1.5 Ton, 3 Star Rating, White): Amazon.in: Home & Kitchen",,3 Star Rating,AR18HC3TXNC,,Remote Control,Brand Fulfilled,,,White,,Split,,,http://www.amazon.in/Samsung-AR18HC3TXNC-Split-Rating-White/dp/B01INHADAI/ref=sr_1_407/254-8499966-4893453?ie=UTF8&qid=1485082725&s=kitchen&sr=1-407
,1.5 tons,43 dB,,,,,,,,B01INHADL2," 36,200.00",Samsung,"Samsung AR18HC3TYUR Split AC (1.5 Ton, 3 Star Rating, White, Aluminium): Amazon.in: Home & Kitchen",,3 Star Rating,AR18HC3TYUR,,Remote Control,Brand Fulfilled,,,White,,Split,,,http://www.amazon.in/Samsung-AR18HC3TYUR-Split-Rating-Aluminium/dp/B01INHADL2/ref=sr_1_405_m/254-8499966-4893453?ie=UTF8&qid=1485082725&s=kitchen&sr=1-405
,1.5 tons,43 dB,,,,,,,,B01INHADLC," 31,700.00",Samsung,"Samsung AR18HC2UXNB Split AC (1.5 Ton, 2 Star Rating, White): Amazon.in: Home & Kitchen",,2 Star Rating,AR18HC2UXNB,,Remote Control,Brand Fulfilled,,,White,,Split,,,http://www.amazon.in/Samsung-AR18HC2UXNB-Split-Rating-White/dp/B01INHADLC/ref=sr_1_404_m/254-8499966-4893453?ie=UTF8&qid=1485082725&s=kitchen&sr=1-404
,1.5 tons,43 dB,,,,,,,,B01INHADL2," 36,200.00",Samsung,"Samsung AR18HC3TYUR Split AC (1.5 Ton, 3 Star Rating, White, Aluminium): Amazon.in: Home & Kitchen",,3 Star Rating,AR18HC3TYUR,,Remote Control,Brand Fulfilled,,,White,,Split,,,http://www.amazon.in/Samsung-AR18HC3TYUR-Split-Rating-Aluminium/dp/B01INHADL2/ref=sr_1_405/254-8499966-4893453?ie=UTF8&qid=1485082725&s=kitchen&sr=1-405
,1.5 tons,43 dB,,,,,,,,B01INHADLC," 31,700.00",Samsung,"Samsung AR18HC2UXNB Split AC (1.5 Ton, 2 Star Rating, White): Amazon.in: Home & Kitchen",,2 Star Rating,AR18HC2UXNB,,Remote Control,Brand Fulfilled,,,White,,Split,,,http://www.amazon.in/Samsung-AR18HC2UXNB-Split-Rating-White/dp/B01INHADLC/ref=sr_1_404/254-8499966-4893453?ie=UTF8&qid=1485082725&s=kitchen&sr=1-404
,1.5 tons,,,,,,,,,B01INHAGWS," 33,100.00",Samsung,"Samsung AR18HC3USUQ Split AC (1.5 Ton, 3 Star Rating, White): Amazon.in: Home & Kitchen",,3 Star Rating,AR18HC3USUQ,,Remote Control,Brand Fulfilled,,,White,1730 Watts,Split,,,http://www.amazon.in/Samsung-AR18HC3USUQ-Split-Rating-White/dp/B01INHAGWS/ref=sr_1_403_m/254-8499966-4893453?ie=UTF8&qid=1485082725&s=kitchen&sr=1-403
,1.5 tons,,,,,,,,,B01INHAGWS," 33,100.00",Samsung,"Samsung AR18HC3USUQ Split AC (1.5 Ton, 3 Star Rating, White): Amazon.in: Home & Kitchen",,3 Star Rating,AR18HC3USUQ,,Remote Control,Brand Fulfilled,,,White,1730 Watts,Split,,,http://www.amazon.in/Samsung-AR18HC3USUQ-Split-Rating-White/dp/B01INHAGWS/ref=sr_1_403/254-8499966-4893453?ie=UTF8&qid=1485082725&s=kitchen&sr=1-403
,1.5 tons,43 dB,,,,,,,,B01INHAH3G," 43,600.00",Samsung,"Samsung AR18HC5EXLZ Split AC (1.5 Ton, 5 Star Rating, Navy Blue): Amazon.in: Home & Kitchen",,5 Star Rating,AR18HC5EXLZ,,Remote Control,Brand Fulfilled,,,Navy Blue,,Split,,,http://www.amazon.in/Samsung-AR18HC5EXLZ-Split-Star-Rating/dp/B01INHAH3G/ref=sr_1_402_m/254-8499966-4893453?ie=UTF8&qid=1485082725&s=kitchen&sr=1-402
,1.5 tons,52 dB,"Good AC with a very low noise operation system. As far as saving electricity is concerned, not sure whether it is saving as much as it should. But, never the less, its worth a buy!",,Awesome Air conditioner with almost no noise. Perfect cooling . Should prefer buying this over all other.,,,,,B00U24YUD2," 31,500.00",Blue Star,"Blue Star 5W18GA Window AC (1.5 Ton, 5 Star Rating, White, Copper): Amazon.in: Home & Kitchen",2 reviews,5 Star Rating,,"33,500.00",Remote Control,5W18GA,#310,"#3,05,108",White,1505 Watts,Window,5.0 out of 5 stars,230 Volts,http://www.amazon.in/Blue-Star-5W18GA-Window-Rating/dp/B00U24YUD2/ref=sr_1_291/253-5426461-9773724?ie=UTF8&qid=1485082721&s=kitchen&sr=1-291
,1.5 tons,41 dB,,,,,,,,B01INHALAK," 60,700.00",Samsung,"Samsung AR18HV5DAWK Split AC (1.5 Ton, 5 Star Rating, White): Amazon.in: Home & Kitchen",1 review,5 Star Rating,AR18HV5DAWK,,Remote Control,Brand Fulfilled,,,White,1310 Watts,Split,1.0 out of 5 stars,,http://www.amazon.in/Samsung-AR18HV5DAWK-Split-Rating-White/dp/B01INHALAK/ref=sr_1_400_m/254-8499966-4893453?ie=UTF8&qid=1485082725&s=kitchen&sr=1-400
,1.5 tons,41 dB,,,,,,,,B01INHALAK," 60,700.00",Samsung,"Samsung AR18HV5DAWK Split AC (1.5 Ton, 5 Star Rating, White): Amazon.in: Home & Kitchen",1 review,5 Star Rating,AR18HV5DAWK,,Remote Control,Brand Fulfilled,,,White,1310 Watts,Split,1.0 out of 5 stars,,http://www.amazon.in/Samsung-AR18HV5DAWK-Split-Rating-White/dp/B01INHALAK/ref=sr_1_400/254-8499966-4893453?ie=UTF8&qid=1485082725&s=kitchen&sr=1-400
,1.5 tons,43 dB,I am using samsung split ac inverter type I got best performance over all.,"Samsung AC purchased in Jan 2014, only used in summer, regularly serviced, still not working now and compressor and condensor both not working. Very bad products.",I am using 1 ton version of this model. It totally noise free and works great in cool mode. You feel like central ac.,,,,,B01INHALAU," 47,600.00",Samsung,"Samsung AR18HV5NFWK Split AC (1.5 Ton, 3 Star Rating, White, Aluminium): Amazon.in: Home & Kitchen",3 reviews,3 Star Rating,AR18HV5NFWK,,Remote Control,Brand Fulfilled,,,White,,Split,3.3 out of 5 stars,,http://www.amazon.in/Samsung-AR18HV5NFWK-Split-Rating-Aluminium/dp/B01INHALAU/ref=sr_1_399_m/254-8499966-4893453?ie=UTF8&qid=1485082725&s=kitchen&sr=1-399
,1.5 tons,43 dB,,,,,,,,B01INHAPJ2," 28,200.00",Samsung,"Samsung AR18JC2UFUQ Split AC (1.5 Ton, 2 Star Rating, Blue Strip, Copper): Amazon.in: Home & Kitchen",,2 Star Rating,AR18JC2UFUQ,,Remote Control,Brand Fulfilled,,,Blue Strip,,Split,,,http://www.amazon.in/Samsung-AR18JC2UFUQ-Split-Rating-Copper/dp/B01INHAPJ2/ref=sr_1_398_m/254-8499966-4893453?ie=UTF8&qid=1485082725&s=kitchen&sr=1-398
,1.5 tons,43 dB,,,,,,,,B01INHADAI," 37,100.00",Samsung,"Samsung AR18HC3TXNC Split AC (1.5 Ton, 3 Star Rating, White): Amazon.in: Home & Kitchen",,3 Star Rating,AR18HC3TXNC,,Remote Control,Brand Fulfilled,,,White,,Split,,,http://www.amazon.in/Samsung-AR18HC3TXNC-Split-Rating-White/dp/B01INHADAI/ref=sr_1_407_m/254-8499966-4893453?ie=UTF8&qid=1485082725&s=kitchen&sr=1-407
,1.5 tons,43 dB,,,,,,,,B01INHAPJ2," 28,200.00",Samsung,"Samsung AR18JC2UFUQ Split AC (1.5 Ton, 2 Star Rating, Blue Strip, Copper): Amazon.in: Home & Kitchen",,2 Star Rating,AR18JC2UFUQ,,Remote Control,Brand Fulfilled,,,Blue Strip,,Split,,,http://www.amazon.in/Samsung-AR18JC2UFUQ-Split-Rating-Copper/dp/B01INHAPJ2/ref=sr_1_398/254-8499966-4893453?ie=UTF8&qid=1485082725&s=kitchen&sr=1-398
,1.5 tons,44 dB,,,,,,,,B01INHAQ2I," 38,600.00",Samsung,"Samsung AR18JC3JBMV Split AC (1.5 Ton, 3 Star Rating, White): Amazon.in: Home & Kitchen",,3 Star Rating,AR18JC3JBMV,,Remote Control,Brand Fulfilled,,,White,1560 Watts,Split,,230 Volts,http://www.amazon.in/Samsung-AR18JC3JBMV-Split-Rating-White/dp/B01INHAQ2I/ref=sr_1_397_m/254-8499966-4893453?ie=UTF8&qid=1485082725&s=kitchen&sr=1-397
,1.5 tons,44 dB,,,,,,,,B01INHAQ2I," 38,600.00",Samsung,"Samsung AR18JC3JBMV Split AC (1.5 Ton, 3 Star Rating, White): Amazon.in: Home & Kitchen",,3 Star Rating,AR18JC3JBMV,,Remote Control,Brand Fulfilled,,,White,1560 Watts,Split,,230 Volts,http://www.amazon.in/Samsung-AR18JC3JBMV-Split-Rating-White/dp/B01INHAQ2I/ref=sr_1_397/254-8499966-4893453?ie=UTF8&qid=1485082725&s=kitchen&sr=1-397
,1 tons,35 dB,Good one with lot of features,,,,,,,B00TZMTHTE," 30,456.00",LG,"LG LSA3SP3D L-Stella Plus Split AC (1 Ton, 3 Star Rating, White, Copper): Amazon.in: Home & Kitchen",1 review,3 Star Rating,,"33,490.00",,LSA3SP3D,#312,"#3,07,553",White,1070 Watts,Split,4.0 out of 5 stars,230 Volts,http://www.amazon.in/LG-LSA3SP3D-L-Stella-Rating-Copper/dp/B00TZMTHTE/ref=sr_1_299/253-5426461-9773724?ie=UTF8&qid=1485082721&s=kitchen&sr=1-299
,1.5 tons,44 dB,"PLEASE DO NOT buy any Samsung products ( online or from store) because Samsung- won't honor the warranty and consumer rights,- would ask for unwarranted charges,- won't provide any service and- makes you suffer by not responding to any of your calls or emails.It is pure mental agony and waste of time with this company's products for which we pay our hard-earned money.PS: If there was a way to rate it with '0' stars, that's what the company deserves.","Best ac now a days but reliability is very less on online shopping for ac's. I've got this ac from local at 34.5k with extra guddies like free stabilizer,installation,stand...","Samsung AC purchased in Jan 2014, only used in summer, regularly serviced, still not working now and compressor and condensor both not working. Very bad products.",,Good,,,B01INHAQ9G," 37,700.00",Samsung,"Samsung AR18JC3HATP Split AC (1.5 Ton, 3 Star Rating, White, Aluminium): Amazon.in: Home & Kitchen",4 reviews,3 Star Rating,AR18JC3HATP,,Remote Control,Brand Fulfilled,,,White,1560 Watts,Split,1.8 out of 5 stars,230 Volts,http://www.amazon.in/Samsung-AR18JC3HATP-Split-Rating-Aluminium/dp/B01INHAQ9G/ref=sr_1_396/254-8499966-4893453?ie=UTF8&qid=1485082725&s=kitchen&sr=1-396
,1.5 tons,44 dB,"PLEASE DO NOT buy any Samsung products ( online or from store) because Samsung- won't honor the warranty and consumer rights,- would ask for unwarranted charges,- won't provide any service and- makes you suffer by not responding to any of your calls or emails.It is pure mental agony and waste of time with this company's products for which we pay our hard-earned money.PS: If there was a way to rate it with '0' stars, that's what the company deserves.","Best ac now a days but reliability is very less on online shopping for ac's. I've got this ac from local at 34.5k with extra guddies like free stabilizer,installation,stand...","Samsung AC purchased in Jan 2014, only used in summer, regularly serviced, still not working now and compressor and condensor both not working. Very bad products.",,Good,,,B01INHAQ9G," 37,700.00",Samsung,"Samsung AR18JC3HATP Split AC (1.5 Ton, 3 Star Rating, White, Aluminium): Amazon.in: Home & Kitchen",4 reviews,3 Star Rating,AR18JC3HATP,,Remote Control,Brand Fulfilled,,,White,1560 Watts,Split,1.8 out of 5 stars,230 Volts,http://www.amazon.in/Samsung-AR18JC3HATP-Split-Rating-Aluminium/dp/B01INHAQ9G/ref=sr_1_396_m/254-8499966-4893453?ie=UTF8&qid=1485082725&s=kitchen&sr=1-396
,1.5 tons,44 dB,,,,,,,,B01INHAQFK," 38,200.00",Samsung,"Samsung AR18JC3ESLW Split AC (1.5 Ton, 3 Star Rating, Maroon, Aluminium): Amazon.in: Home & Kitchen",,3 Star Rating,AR18JC3ESLW,,Remote Control,Brand Fulfilled,,,Maroon,1560 Watts,Split,,230 Volts,http://www.amazon.in/Samsung-AR18JC3ESLW-Rating-Maroon-Aluminium/dp/B01INHAQFK/ref=sr_1_395_m/254-8499966-4893453?ie=UTF8&qid=1485082725&s=kitchen&sr=1-395
